"HSCI","1011","Digital World","Twin Cities","Essential knowledge and critical perspective to understand today's Digital World. The history and social impact of the digital revolution, including security, surveillance, ""virtual reality,"" and the future of the Internet.","3","3","No","1","3","OPT - Student Option","000677","Every Spring"
"HSCI","1212","Life on Earth: Origins, Evolution & Ecology","Twin Cities","How have people explained where life came from and how it has developed over time? We examine controversies over life's origins, the Holocene extinction, human population growth, the Dust Bowl and soil conservation, DDT and falcon repatriation, and disease and responses to pandemics. Evolution, natural theology. Ecosystems.","4","4","No","1","4","OPT - Student Option","-","Every Spring"
"HSCI","1585","Mammoths, Minerals, Monoculture: History of Earth and Environmental Science","Twin Cities","This course investigates the many ways people across the globe have sought to understand the environment and the earth from antiquity to the present.  We will study the context in which the modern earth and environmental sciences emerged, asking throughout the semester what knowledge traditions contributed to the development of the sciences we know today.  We will investigate the historical perspectives that shaped three intersecting themes throughout the semester: the questions of geological time and of change in the study of the earth; human use of natural resources in industry and agriculture; and understandings of the earth and environment as a global system.   We will examine secondary historical scholarship and primary sources from North and South America, Africa, Europe, and Asia in order to better understand the religious and philosophical stakes of earth and environmental science, the role of empire and state building in the development of geoscience, and the interrelationship of science and industry.  ","3","3","No","1","4","OPT - Student Option","-","Every Fall"
"HSCI","1714","Stone Tools to Steam Engines: Technology and History to 1750","Twin Cities","Technology is an enormous force in our society, and has become so important that in many ways it seems to have a life of its own. This course uses historical case studies to demonstrate that technology is not autonomous, but a human activity, and that people and societies made choices about the technologies they developed and used. It asks how technological differences between nations influenced their different courses of development, and why some societies seemed to advance while others did not. We ask how technological choices can bring about consequences greater than people expected, and how we might use this knowledge in making our own technological choices. In particular, we explore the historical background, development, and character of the most widespread technological systems the world has known, from prehistoric stone tool societies, through Egypt and the pyramids, ancient Greece and Rome, the explosion of Islam, and the dynamic and often violent technologies of medieval Europe.","3","4","No","1","4","OPT - Student Option","-","Every Fall & Spring"
"HSCI","1715","History of Modern Technology: Waterwheels to the Web","Twin Cities","This course explores the many technological systems that have come to span our globe, alongside the widespread persistence of traditional technologies. We start with the earliest glimmerings of modernity and industrialization, and move on in time to the building of global technological networks. How have people changed their worlds through technologies like steam engines and electronics?  Is it a paradox that many traditional agricultural and household technologies have persisted? How have technologies of war remade the global landscape? We ask how business and government have affected technological entrepreneurs, from railroads to technologies of global finance. We end by considering the tension between technologies that threaten our global environment and technologies that offer us hopes of a new world.","3","4","No","1","4","OPT - Student Option","-","Every Fall & Spring"
"HSCI","1814","Revolutions in Science: The Babylonians to Newton","Twin Cities","Development and changing nature of sciences in their cultural context. Babylonian/Greek science. Decline/transmission of Greek science. Scientific Revolution (1500-1700) from Copernicus to Newton.","3","4","No","1","4","OPT - Student Option","-","Every Fall & Spring"
"HSCI","1815","Making Modern Science: Atoms, Genes and Quanta","Twin Cities","How scientists like Darwin and Einstein taught us to think about nature; everything from space, time and matter to rocks, plants, and animals.","3","4","No","1","4","OPT - Student Option","-","Periodic Fall, Spring & Summer"
"HSCI","3211","Biology and Culture in the 19th and 20th Centuries","Twin Cities","Changing conceptions of life and aims and methods of biology; changing relationships between biology and the physical and social sciences; broader intellectual and cultural dimensions of developments in biology.","3","3","No","1","3","OPT - Student Option","-","Every Fall & Spring"
"HSCI","3242","Navigating a Darwinian World","Twin Cities","In this course we grapple with the impact of Darwin's theory of evolution in the scientific community and beyond. We'll examine and engage the controversies that have surrounded this theory from its inception in the 19th century through its applications in the 21st. What made Darwin a Victorian celebrity, a religious scourge, an economic sage and a scientific hero? We'll look closely at the early intellectual influences on theory development; study the changing and dynamic relationship between science and religion; and critically analyze the application of Darwin's theory to questions of human nature and behavior.","3","3","No","1","3","OPT - Student Option","-","Every Fall"
"HSCI","3244","Nature's History: Science, Humans, and the Environment","Twin Cities","We examine environmental ideas, sustainability, conservation history; critique of the human impact on nature; empire and power in the Anthropocene; how the science of ecology has developed; and modern environmental movements around the globe. Case studies include repatriation of endangered species; ecology and evolutionary theory; ecology of disease; and climate change.","3","3","No","1","3","OPT - Student Option","-","Every Fall"
"HSCI","3246","History of (Un)Natural Disasters","Twin Cities","Earthquakes, hurricanes, tsunamis, wildfires, epidemic disease, and technological failures? This course will examine large scale natural events in American and world history, the social, technological, and environmental conditions that underlie them, and their historical consequences. Human societies have long been embedded in physical landscapes where they are subject to specific environmental conditions and physical risks: eight thousand-year-old wall paintings in Turkey depict the eruption of Hasan Dag volcano over the city of Catal Huyuk, for example. But then and now, it takes a certain combination of social conditions and environmental events to create a natural disaster. In this course, we will use historical natural disasters to explore the interconnections between the structures and ideas of human society and environmental forces. Humans have not been simply the random victims of natural disasters; where and how they chose to live influenced the impact of any disastrous event. Examining these events in a historical context will help us see the social, technological, scientific, and environmental systems that have been constantly interacting, but which are normally taken for granted until they break down.","3","3","No","1","3","OPT - Student Option","-","Periodic Spring"
"HSCI","3331","Technology and American Culture","Twin Cities","American culture(s) and technology, pre-Columbian times to present. Artisanal, biological, chemical, communications, energy, environment, electronic, industrial, military, space and transportation technologies explained in terms of economic, social, political and scientific causes/effects.","3","3","No","1","3","OPT - Student Option","-","Every Fall & Spring"
"HSCI","3332","Science in the Shaping of America","Twin Cities","Science played a central role in taking scattered imperial colonies in North America to world power in just four centuries. This course investigates people, policies, and knowledge-making in a culture whose diversity was a critical part of its expanding capacities. It begins by examining the differences in ways of knowing as well as shared knowledge between Native Americans and Europeans and concludes by discussing how a powerful nation's science and technology shaped international relations. Class, race, ethnicity, and gender provided for a range of perspectives that contributed to science alongside social and economic developments. Online assignments, films and images, along with primary and secondary source readings provide the basis for class discussion.","3","3","No","1","3","OPT - Student Option","-","Periodic Spring"
"HSCI","3401","Ethics in Science and Technology","Twin Cities","Technology is assumed to be the best engineered solution for a particular goal and good science is supposed to be objective; however, this is never truly the case: values and moral choices underlie all of our systems for understanding and interacting with the world around us. These values and choices are almost always contentious. Through a series of historical case studies, we explore how science and technology are products of human choices—but at the same time, how science and technology enable and constrain the choices we can make. Case studies include algorithms and inequality, artificial intelligence (AI) and surveillance, privacy and social media, lay expertise and medicine, and environmental and technological disasters. Our goal will be to learn to question and think critically about the things we create, the tools we use, and the ideology and practice of science. First year students are welcome.","3","3","No","1","3","OPT - Student Option","-","Periodic Fall"
"HSCI","3421","Engineering Ethics","Twin Cities","Ethical issues in engineering research and engineers' public responsibility/practice, using historical cases; historical development of engineering as a vocation/profession; ethical implications of advanced engineering systems such as nuclear weaponry and networked communications. ","3","3","No","1","3","OPT - Student Option","-","Every Fall & Spring"
"HSCI","3611","Enlightenment, Revolution, and the Rise of Modern Science","Twin Cities","Understanding the origins of our own culture of Modern Science in the Enlightenment of the eighteenth century. Newton's ambiguous legacy; science as wonder and spectacle; automata and monsters; early theories of sex and gender; empire and scientific expeditions; reshaping the environment; inventing human sciences; Frankenstein and the limits of science and reason.","3","3","No","1","3","OPT - Student Option","-","Periodic Spring"
"HSCI","3714","Stone Tools to Steam Engines: Technology and History to 1750","Twin Cities","Technology is an enormous force in our society, and has become so important that in many ways it seems to have a life of its own. This course uses historical case studies to demonstrate that technology is not autonomous, but a human activity, and that people and societies made choices about the technologies they developed and used. It asks how technological differences between nations influenced their different courses of development, and why some societies seemed to advance while others did not. We ask how technological choices can bring about consequences greater than people expected, and how we might use this knowledge in making our own technological choices. In particular, we explore the historical background, development, and character of the most widespread technological systems the world has known, from prehistoric stone tool societies, through Egypt and the pyramids, ancient Greece and Rome, the explosion of Islam, and the dynamic and often violent technologies of medieval Europe.","3","4","No","1","4","OPT - Student Option","-","Every Fall & Spring"
"HSCI","3715","History of Modern Technology: Waterwheels to the Web","Twin Cities","This course explores the many technological systems that have come to span our globe, alongside the widespread persistence of traditional technologies. We start with the earliest glimmerings of modernity and industrialization, and move on in time to the building of global technological networks. How have people changed their worlds through technologies like steam engines and electronics? Is it a paradox that many traditional agricultural and household technologies have persisted? How have technologies of war remade the global landscape? We ask how business and government have affected technological entrepreneurs, from railroads to technologies of global finance. We end by considering the tension between technologies that threaten our global environment and technologies that offer us hopes of a new world.","3","4","No","1","4","OPT - Student Option","-","Every Fall & Spring"
"HSCI","3814","Revolutions in Science: The Babylonians to Newton","Twin Cities","Development and changing nature of sciences in their cultural context. Babylonian/Greek science. Decline/transmission of Greek science. Scientific Revolution (1500-1700) from Copernicus to Newton.","3","4","No","1","4","OPT - Student Option","-","Every Fall & Spring"
"HSCI","3815","Making Modern Science: Atoms, Genes and Quanta","Twin Cities","How scientists like Darwin and Einstein taught us to think about nature; everything from space, time and matter to rocks, plants, and animals.","3","4","No","1","4","OPT - Student Option","-","Periodic Fall, Spring & Summer"
"HSCI","4321","History of Computing","Twin Cities","Developments in the last 150 years; evolution of hardware and software; growth of computer and semiconductor industries and their relation to other business areas; changing relationships resulting from new data-gathering and analysis techniques; automation; social and ethical issues.  ","3","3","No","1","3","OPT - Student Option","-","Fall Even, Spring Odd Year"
"HSCI","4455","Women, Gender, and Science","Twin Cities","Three intersecting themes analyzed from 1700s to the present: women in science, sexual and gendered concepts in modern sciences, and impact of science on conceptions of sexuality and gender in society.","3","3","No","1","3","OPT - Student Option","-","Every Fall & Spring"
"HSCI","5401","Ethics in Science and Technology","Twin Cities","Technology is assumed to be the best engineered solution for a particular goal and good science is supposed to be objective; however, this is never truly the case. Values and moral choices underlie all of our systems for understanding and interacting with the world around us. These values and choices are almost always contentious. Through a series of historical case studies, we explore how science and technology are products of human choices—but at the same time, how science and technology enable and constrain the choices we can make. Case studies include algorithms and inequality, artificial intelligence (AI) and surveillance, privacy and social media, lay expertise and medicine, and environmental and technological disasters. Our goal will be to learn to question and think critically about the things we create, the tools we use, and the ideology and practice of science.","3","3","No","1","3","OPT - Student Option","001186","Periodic Fall"
"HSEM","2073H","Radical Environmentalism in the United States","Twin Cities","Our current climate crisis calls for a rethinking of the way humans interact with the environment, but such efforts are not new.  This course examines how different groups of people understood and responded to environmental degradation in North America, from the l8th century through the 21st.  The focus will be on those who made urgent calls for a change in human behavior toward nature, from Indigenous peoples past and present to ecocentrist groups like Greenpeace and Earth First!  Topics include protests against ecological damage and loss, experiments in minimalism, the call for wilderness preservation and national parks, environmental racism and the environmental justice movement, and various forms of environmental activism.  Students will develop historically informed positions about an array of ecological experiments, activists, organizations, viewpoints that preceded and shaped current forms of environmentalism.","3","3","No","1","3","A-F - A-F Grade Basis","000571","Periodic Fall"
"HSEM","2540H","Understanding the Russian Land","Twin Cities","Encompassing more than 6.5 million square miles, Russia is an immense and ecologically diverse country. The environment of the frigid and heavily forested heartland of early Russian civilization, as well as that of the ""wild field"" (the Eurasian steppe) on its border, have posed a series of challenges to Russians and have left an indelible mark on modern Russian culture.  In this interdisciplinary seminar, we will study how Russians have conceived of and used nature from the medieval period to the dissolution of the Soviet Union. Articulating a particular approach to nature has been integral to several ideological and cultural projects in Russian history, including the formation of a literary tradition, the establishment of a multi-ethnic empire encompassing several biomes, and the development of a vision of Soviet science conquering and reshaping nature and the world. In the period we will study (the fifteenth century to 1991 Russia) underwent several profound epistemological shifts, and a particular focus of this course will be how the ways Russians created natural knowledge changed over time. Knowledge is power, and we will study how natural knowledge was used to strengthen and expand the state in the medieval, imperial, and Soviet periods. Another major focus of this course is the ravages that nature and humankind have inflicted on one another, and we will study how the environment influenced the development of Russia's form of agricultural slavery, serfdom, as well as the history of environmental degradation, including deforestation, the establishment of heavy industry, and nuclear disaster.","3","3","No","1","3","A-F - A-F Grade Basis","000571","Periodic Spring"
"IDES","3162","History of Interiors and Furnishings: 1750 to Present","Twin Cities","European/American interiors/furnishings, including furniture, textiles, and decorative objects.","4","4","No","1","4","AFV - A-F or Audit","-","Every Spring"
"JOUR","3007","The Media in American History and Law: Case Studies","Twin Cities","In this class, you'll study news media and their social, cultural, and political impact during a specific historical time period, based on the instructor's expertise and area of research. Examples include: Journalism during the Civil War; Mass media and the African American struggle for civil rights; the Sixties and rise of the New Journalism.  Instructors of the course may vary from term to term and students may wish to contact the instructor for information on the specific focus of his or her section. ","3","3","No","1","3","OPT - Student Option","-","Every Fall"
"JOUR","3614","History of Media Communication","Twin Cities","In the history of humankind, there have been five major changes in how we communicate and we're in the middle of the latest revolution. This class helps you make sense of these uncharted waters by exploring how humanity adopted, and adapted to, past disruptions. From the alphabet to the internet and social media, learn how technological innovations in the media have changed not only how people share information and values but also what people have communicated throughout history. We will learn about these five phases in mediated communication over 5,000 years, and how they relate to major changes in politics, society and culture. And then we'll use history's lessons to peek into the future: When presidents tweet and everyone's foodie photos are on Instagram, how does the world communicate?","3","3","No","1","3","OPT - Student Option","-","Every Spring"
"JWST","1034","Introduction to Jewish History and Cultures","Twin Cities","This course traces the development of Judaism and Jewish civilizations from their beginnings to the present. With over three millennia as its subject, the course must of necessity be a general survey. Together we will explore the mythic structures, significant documents, historical experiences, narratives, practices, beliefs, and worldviews of the Jewish people. The course begins by examining the roots of Judaism in the Hebrew Bible and the history of ancient Israel but quickly focuses on the creative forces that developed within Judaism as a national narrative confronted the forces of history, especially in the forms of the Persian, Greek, and Roman empires.  Rabbinic Judaism becomes the most dominant creative force and will receive our greatest attention, both in its formative years and as it encounters the rise of Christianity and Islam. After studying the Jewish experience in the medieval world, we will turn to Judaism’s encounter with the enlightenment and modernity. The historical survey concludes by attending to the transformations within Judaism and Jewish life of the last 150 years, including a confrontation with the experience of the Holocaust. Woven throughout this historical survey will be repeated engagements with core questions: “Who is a Jew?” “What do Jews believe?” “What do Jews do?” “What do we mean by ‘religion’?”   “How do Jews read texts within their tradition?” And perhaps most importantly, “How many answers are there to a Jewish question?” Students in this course can expect to come away with some knowledge of the Bible in Judaism, rabbinic literature and law, Jewish mysticism and philosophy, Jewish nationalism and Zionism, Jewish culture, ritual, and worship in the synagogue, the home, and the community, and Jewish celebrations of life cycle events and the festivals.","3","3","No","1","3","OPT - Student Option","-","Every Fall"
"JWST","3011","Jewish American Literature: Religion, Culture, and the Immigrant Experience","Twin Cities","Immigrant? Jewish? American?  What do these labels mean, why are they applied, and do they ever cease to be applicable? Can we distinguish religion from culture, and what are the implications when we try? Why is it frequently asked whether Saul Bellow was “really” a Jewish writer, but it is impossible to read Philip Roth as anything other than that? How does Grace Paley’s “Jewishness” come through even when she is writing about non-Jewish characters? We will address these issues and others as we explore the literature growing out of the Jewish immigrant experience in America, as well as the literature by Jewish writers more firmly, though still sometimes anxiously, rooted in American soil.

In this course we will engage in a highly contextualized and historicized study of Jewish American literature from the 19th century to today.  We will discover in these texts how inherited Jewish culture and literary imaginings, developed over centuries of interaction between Jewish communities and the “outside world,” get reexamined, questioned, rejected, reimagined, reintegrated, and transformed within the crucible of American experience. The discussions that ensue will also provide a framework for engaging with the creative energies and cultural productivity of more recent immigrant communities in the United States and beyond. Immigration and the experience of immigrant communities continues to be at the forefront of American consciousness, as immigrants work to create new meanings and new narratives for their lives, and as those who immigrated before them provide contested meanings for the impact of immigration on their own narratives. This course, though grounded in Jewish narratives, will therefore provide students with an expanded vocabulary and perspective for engaging in this central and very current debate within the American experience. ","3","3","No","1","3","OPT - Student Option","-","Every Spring"
