"FREN","3861","The Francophone World in Film : West and Central Africa and the French Caribbean","Twin Cities","This course focuses on films representing peoples and cultures from Francophone Africa south of Sahara, the French Caribbean as well as black populations in France. It explores historical developments, cultures, and current issues facing the above populations through a set of contemporary films that stand out both for their exceptional aesthetic quality as well as their remarkable ability to confront pressing political and social issues. We will first discuss the ways in which visual media from the west have contributed to creating and perpetuating dominant tropes concerning black peoples, looking especially at the contribution of colonial imagery to the creation of such perceptions. We will subsequently examine the emergence of film-making in Africa before focusing on films by black directors from West and Central Africa, France, and the French Caribbean. Issues explored include migration, race, the colonial legacy, postcolonial identities, gender, sexuality, globalization, and development. The course is taught in French.

prereq: FREN 3016","3","3","No","1","3","OPT - Student Option","-","Spring Odd Year"
"FRIT","1601","Migrants and Refugees in Mediterranean Cinema","Twin Cities","This course deals with films made in France, Spain, Italy, the Maghreb (Morocco, Algeria, and Tunisia), sub-Saharan Africa and the Levant (mostly Syria). All of the films tackle migration and most of them deal with the crossing of the Mediterranean  Sea in particular. It focuses on how migrants, regular and clandestine migrations, as well as related themes, including globalization, hospitality and transnational modes of transportation have been filmed, discussed and written about in various types of discourses. 

Why and how do people emigrate? Where are the major destinations of migrants? What is Fortress Europe? What is the “global South?” What is the so-called refugee crisis? Who is a refugee? What impact has the Arab Spring had on contemporary migrations to Europe? How does mass media portray the global South? What do political discourses tell us about the European and North African handlings of recent human migratory movements? Can artists effectively put forward an alternate take on such issues? What types of responses in artistic productions as well as in the political and humanitarian arenas have failed attempts at crossing the Mediterranean Sea triggered? These are some of the questions we will address. Among the films that we will analyze—all shown in class—are Chus Gutiérrez’s Return to Hansala, Reem Kherici’s Paris or Perish, Ismaël Ferroukhi’s The Grand Voyage and Gianfranco Rosi’s Fire at Sea. 

All films have English subtitles. The class will be conducted in English.","3","3","No","1","3","OPT - Student Option","-","Periodic Spring"
"FSCN","2512","Food Customs and Culture","Twin Cities","Account of traditional and contemporary food customs and culture. Practice of food choice, preparation, and preservation in the context of worldview, perspectives on diet and health, and belief systems of communities and societies around the world. Major emphasis on US cultures including Native American, Hispanic American, European American, African American, and Asian American. Development of cultural self-understanding and intercultural awareness via food and food habits-related experiences and reflections. ","3","3","No","1","3","AFV - A-F or Audit","-","Every Fall & Spring"
"FSCN","2512H","Food Customs and Culture - Honors","Twin Cities","Account of traditional and contemporary food customs and culture. Practice of food choice, preparation, and preservation in the context of worldview, perspectives on diet and health, and belief systems of communities and societies around the world. Major emphasis on US cultures including Native American, Hispanic American, European American, African American, and Asian American. Development of cultural self-understanding and intercultural awareness via food and food habits-related experiences and reflections. ","3","3","No","1","3","A-F - A-F Grade Basis","000585","Every Fall & Spring"
"FSOS","4158","Thailand: Global Change, Communities and Families","Twin Cities","This interdisciplinary course uses social justice and human ecological lenses to examine global change that is occurring at the intersections among Thailand's natural environment, communities, families, and culture. Topics include globalization, human trafficking, education, religion, environmental issues, and cultural integration/identity formation, particularly among indigenous populations in northern Thailand. Students interact with key community leaders, village leaders, elders, and students who serve as teachers; this leads to critical understanding of Thai culture and the contemporary issues faced by Thailand's families and communities. Through journaling, digital stories, blogging, and discussions, students will synthesize, integrate, apply, and communicate what they've learned.","3","3","No","1","3","A-F - A-F Grade Basis","-","Periodic Spring"
"GCC","3003","Seeking Solutions to Global Health Issues","Twin Cities","Often, the most progress on challenging issues such as health and equity is made when you apply an interdisciplinary perspective. The same is true for global health issues. Whether responding to emerging pandemics, food insecurity, maternal mortality, or civil society collapse during conflict, solutions often lie at the intersection of animal, environmental, and human health.

In this course, students will work in teams to examine the fundamental challenges to addressing complex global health problems in East Africa and East African refugee communities here in the Twin Cities. Together we will seek practical solutions that take culture, equity, and sustainability into account. In-field professionals and experts will be available to mentor each team, including professionals based in Uganda and Somalia. This exploration will help students propose realistic actions that could be taken to resolve these issues. This course will help students gain the understanding and skills necessary for beginning to develop solutions to global health issues. 

This is a Grand Challenge Curriculum course. GCC courses are open to all students and fulfill an honors experience for University Honors Program students. ","3","3","No","1","3","A-F - A-F Grade Basis","000959","Periodic Fall"
"GCC","3005","Innovation for Changemakers: Design for a Disrupted World","Twin Cities","Do you want to make a difference? We live at the intersection of COVID-19, racism, economic recession, and environmental collapse. Now is the time to make an impact.

In this project-based course, you will work in interdisciplinary teams. You'll develop entrepreneurial responses to current social and environmental problems. You'll develop tools, mindsets, and skills to address any complex grand challenge. Your project may address food insecurity, unemployment, housing, environmental impacts, equity, or other issues. Proposed designs for how you might have a social impact can take many forms (student group, program intervention with an existing organization, public policy strategy, or for-profit or non-profit venture) but must have ideas for how to be financially sustainable. 

Community members, locally and globally, will serve as mentors and research consultants to teams. Weekly speakers will share their innovative efforts to serve the common good.

A primary focus of the course is up-front work to identify the “right” problem to solve. You will use a discovery process, design thinking, and input from field research to addressing the challenge you choose. You will build a model around the community’s culture, needs, and wants.

By the end of the class, you will have a well-designed plan to turn your project into an actionable solution if that is of interest. 

This is a Grand Challenge Curriculum course. GCC courses are open to all students and fulfill an honors experience for University Honors Program students.","3","3","No","1","3","A-F - A-F Grade Basis","000959","Periodic Fall & Summer"
"GCC","3017","World Food Problems: Agronomics, Economics and Hunger","Twin Cities","This course provides a multi-disciplinary look at problems (and some of the possible solutions) affecting food production, distribution, and requirements for the seven plus billion inhabitants of this planet. It is co-taught by a plant geneticist (Morrell) and an economist (Runge) who together have worked on international food production and policy issues for the past 40 years. Historical context, the present situation and future scenarios related to the human population and food production are examined. Presentations and discussions cover sometimes conflicting views from multiple perspectives on population growth, use of technology, as well as the ethical and cultural values of people in various parts of the world. The global challenge perspective is reflected in attention to issues of poverty, inequality, gender, the legacy of colonialism, and racial and ethnic prejudice. Emphasis is placed on the need for governments, international assistance agencies, international research and extension centers, as well as the private sector to assist in solving the complex problems associated with malnutrition, undernutrition, obesity, and sustainable food production.

Through a better understanding of world food problems, this course enables students to reflect on the shared sense of responsibility by nations, the international community and ourselves to build and maintain a stronger sense of our roles as historical agents. Throughout the semester students are exposed to issues related to world food problems through the lenses of two instructors from different disciplinary backgrounds. The core issues of malnutrition and food production are approached simultaneously from a production perspective as well as an economic and policy perspective throughout the semester.  

This is a Grand Challenge Curriculum course. GCC courses are open to all students and fulfill an honors experience for University Honors Program students.","3","3","No","1","3","A-F - A-F Grade Basis","000959","Periodic Fall"
"GCC","5003","Seeking Solutions to Global Health Issues","Twin Cities","Often, the most progress on challenging issues such as health and equity is made when you apply an interdisciplinary perspective. The same is true for global health issues. Whether responding to emerging pandemics, food insecurity, maternal mortality, or civil society collapse during conflict, solutions often lie at the intersection of animal, environmental, and human health.In this course, students will work in teams to examine the fundamental challenges to addressing complex global health problems in East Africa and East African refugee communities here in the Twin Cities. Together we will seek practical solutions that take culture, equity, and sustainability into account. In-field professionals and experts will be available to mentor each team, including professionals based in Uganda and Somalia. This exploration will help students propose realistic actions that could be taken to resolve these issues. This course will help students gain the understanding and skills necessary for beginning to develop solutions to global health issues. This is a Grand Challenge Curriculum course. GCC courses are open to all students and fulfill an honors experience for University Honors Program students. ","3","3","No","1","3","A-F - A-F Grade Basis","000574","Periodic Fall"
"GCC","5005","Innovation for Changemakers: Design for a Disrupted World","Twin Cities","Do you want to make a difference? We live in a world full of complex challenges, such as COVID-19, racism, economic recession, and environmental collapse, to name a few. Now is the time to use your own skills and passion to make a positive impact in the world. In this project-based course, you will learn how to develop effective and sustainable responses to current social and environmental problems. You'll study a variety of tools, mindsets, and skills that will help you to address any complex grand challenge, as well as engage with case studies of successful grand challenge projects in the past. Your project may address food insecurity, unemployment, housing, environmental impacts, equity, or other issues. Proposed designs for how you might have an impact may take many forms (student group, program intervention with an existing organization, public policy strategy, or for-profit or non-profit venture) but this class will focus on how to make ideas financially sustainable. The primary focus of this (GCC 5005) course is how to develop a pilot project plan that addresses a grand challenge. You will learn business modeling, financial projections, and pitching to potential investors and funders. You will build a model for your idea around input from primary and secondary research, as well as the affected community's culture, needs, and wants.

Community members, locally and globally, may serve as mentors and research consultants to teams. External speakers will be brought in to share their stories of how to build and scale innovative efforts to serve the common good. Students enrolled will work either independently, or in small teams, on a project of their own choosing. Ideally, students will apply to take this class with a project in mind. By the end of the class, students will have a well-designed plan to turn their project into an actionable solution if that is of interest.

This is a Grand Challenge Curriculum course. GCC courses are open to all students and fulfill an honors experience for University Honors Program students.","3","3","No","1","3","A-F - A-F Grade Basis","000574","Periodic Fall & Summer"
"GCC","5017","World Food Problems: Agronomics, Economics and Hunger","Twin Cities","This course provides a multi-disciplinary look at problems (and some of the possible solutions) affecting food production, distribution, and requirements for the seven plus billion inhabitants of this planet. It is co-taught by a plant geneticist (Morrell) and an economist (Runge) who together have worked on international food production and policy issues for the past 40 years. Historical context, the present situation and future scenarios related to the human population and food production are examined. Presentations and discussions cover sometimes conflicting views from multiple perspectives on population growth, use of technology, as well as the ethical and cultural values of people in various parts of the world. The global challenge perspective is reflected in attention to issues of poverty, inequality, gender, the legacy of colonialism, and racial and ethnic prejudice. Emphasis is placed on the need for governments, international assistance agencies, international research and extension centers, as well as the private sector to assist in solving the complex problems associated with malnutrition, undernutrition, obesity, and sustainable food production.Through a better understanding of world food problems, this course enables students to reflect on the shared sense of responsibility by nations, the international community and ourselves to build and maintain a stronger sense of our roles as historical agents. Throughout the semester students are exposed to issues related to world food problems through the lenses of two instructors from different disciplinary backgrounds. The core issues of malnutrition and food production are approached simultaneously from a production perspective as well as an economic and policy perspective throughout the semester.  This is a Grand Challenge Curriculum course. GCC courses are open to all students and fulfill an honors experience for University Honors Program students.","3","3","No","1","3","A-F - A-F Grade Basis","000574","Periodic Fall"
"GEOG","1372","Geography of Global Cities","Twin Cities","Urban forms/processes. Uses key global cities as examples.  Political, historical, and economic contexts of cities. Planning ideologies. Globalization. Race/segregation. Population growth. Environmental problems. Current issues in global urbanization.","3","3","No","1","3","OPT - Student Option","-","Every Fall"
"GEOG","3145","The Islamic World: A Global Introduction","Twin Cities","The Islamic World provides a comprehensive introduction on Islam from its inception to today. The course’s journey begins with Islam’s dawn in the small desert oasis of Mecca in the Arabian peninsula over 14 centuries ago to today when it is a worldwide faith. One hundred years from its inception, Islam spread to what is today Syria, Iraq, the Horn of Africa, North Africa, and across the Mediterranean Sea. Central Asia, the Indian subcontinent, and Anatolia (Turkey) came under the sway of Islam leading to the emergence of three major Islamic civilization that dominated and enlightened the old world for several centuries. This era came to an end with the rise of Capitalist Europe and its colonization of much of the world including Muslim societies. Like many colonized peoples, Muslims threw the yoke of colonialism and joined the postcolonial World. Beyond this historical geographic survey, the course examines the Muslim World’s relationships with the West, democracy, and development. It will also explore how Muslim and Islam engage the seemingly contemporary topics such as human rights, gender relations, the monumental environmental crisis of our time, the war on terror and the terror of war, and the Palestinian-Israeli conflict. Soo Dhawoow (Welcome).","3","3","No","1","3","OPT - Student Option","-","Every Fall"
"GEOG","3161","How the World Made Europe","Twin Cities","It is impossible to think about the contemporary world without the lasting impact Europe has had on it. But what are the deeper reasons for Europe to emerge as a dominant region from the late Middle Ages onwards? Why has Europe recently found itself in profound economic and political, even existential crisis? Historical geography provides answers. Divided by landscape, language, religion, and war, European empires imposed the state-form, capitalism, and their cultures on the rest of the world. European societies even became the supposed standard for how all humanity is meant to live. But there have always been cracks in this success story. The project of the European Union promised peace and prosperity for half a billion people but faces unprecedented challenges, from Brexit, the Ukraine war, and the return of state racism to climate change and covid. This course will guide you through Europe?s general historical characteristics to understand how it shaped globalization.","3","3","No","1","3","OPT - Student Option","-","Fall Even Year"
"GEOG","3331","Geography of the World Economy","Twin Cities","An invisible, not-quite-dead, not-quite-alive entity—the coronavirus—forced us, rudely and tragically, to reckon with space. As we try and maintain social distance from other bodies, wear masks to disrupt the virus’ pathways of diffusion, confront shortages in grocery stores, home supply outlets, and car dealerships, adjust to interruptions in many services, and either choose to, or are forced to stay at home, in our cities, in our countries, we are thinking and acting spatially. And we are reminded that “stuff”—food, medicines, toilet paper—reaches us often through geographically extensive and logistically intricate webs of economic production and distribution.

We will learn what it means to think geographically about the capitalist economy as a spatial, relational formation. In doing so, we will challenge dominant ways of understanding and analyzing the economy, and of what counts as economic. We will also examine two simultaneous aspects of the world economy—fixity and flow. On the one hand, the economy propels and is propelled by flows—of goods, of services, of people, of labor, and of finance. On the other hand, physical infrastructures are rooted in place on the earth. After all, even the digital worlds of Facebook, Google, and Amazon are enabled by vast server farms. The course will also highlight the production and proliferation of inequalities—between social groups, states, countries, and regions—in and by the world economy. In fact, we will ask: Is economic unevenness a mere byproduct of capitalist economic growth, or the condition of possibility for it? Finally, we will discuss the relationships between global phenomena and local events. Crises like global climate change, overflows of waste matter, COVID19, and the 2008 financial meltdown make it clear that the global and the local are intimately entangled. Not only do global events impact individual livelihoods, including yours and mine, but economic jitters in one place can escalate, sending shockwaves across the world.
","3","3","No","1","3","OPT - Student Option","-","Every Fall"
"GEOG","3373","Changing Form of the City","Twin Cities","Urban origins, ancient cultures/cities, the medieval city, rediscovery of planning, colonial cities. Industrialization and urban expansion. Speculative cities, utopian cities, planning triumphs/disasters. Cities as reflections of society, culture, the past.","3","3","No","1","3","OPT - Student Option","-","Every Spring"
"GER","1551","Sustainability in Germany: Recreation, Education, Innovation","Twin Cities","How has Germany responded to the grand challenge of climate-change? In what ways are perspectives on climate change & sustainability reflected in everyday culture? This course is designed for students to seek answers to these questions by experiencing life in Germany first-hand. During the first part of the course, you will review concepts & vocabulary related to climate change & sustainability, learn about the stages of intercultural development, reflect on your own cultural identity, practice conversational speaking in German, & prepare to immerse yourself in a foreign country. In May, you will apply what you learned as you travel to Freiburg & Munich. There you will see innovative technologies developed to lower CO2 emissions & talk with students, teachers, & business owners to learn about green communities that promote sustainable living.  Finally, you will reflect on your own intercultural development as well as how approaches in Germany to climate change differ or are similar to those in your own country.
prereq: Ger 1003 or equivalent; may be concurrently enrolled in 1003
","3","3","No","1","3","OPT - Student Option","-","Every Spring"
"GER","3551","Sustainability in Germany: Recreation, Education, Innovation","Twin Cities","How has Germany responded to the grand challenge of climate-change? In what ways are perspectives on climate change & sustainability reflected in everyday culture? This course is designed for students to seek answers to these questions by experiencing life in Germany first-hand. During the first part of the course, you will review concepts & vocabulary related to climate change & sustainability, learn about the stages of intercultural development, reflect on your own cultural identity, practice conversational speaking in German, & prepare to immerse yourself in a foreign country. In May, you will apply what you learned as you travel to Freiburg & Munich. There you will see innovative technologies developed to lower CO2 emissions & talk with students, teachers, & business owners to learn about green communities that promote sustainable living. Finally, you will reflect on your own intercultural development as well as how approaches in Germany to climate change differ or are similar to those in your own country. 
prereq: Ger 3011 or equivalent; may be concurrently enrolled in 3011","3","3","No","1","3","OPT - Student Option","-","Every Spring"
"GER","3601","German Medieval Literature","Twin Cities","Literary investigation of the greatest works of medieval German poetry. Readings in English.  Majors will be required to write a paper with  use of secondary sources in English and German.

prereq: No knowledge of German required","3","3","No","1","3","OPT - Student Option","-","Fall Odd, Spring Even Year"
"GER","3633","The Holocaust: Memory, Narrative, History","Twin Cities","Decades after the end of the second world war, the Holocaust continues to play a formative role in public discourse about the past in Germany and Austria. As the event itself recedes into the past, our knowledge about the Holocaust has become increasingly shaped by literary and filmic representations of it. This course has several objectives: first, to deepen students' historical knowledge of the events and experiences of the Holocaust, and at the same time to introduce critical models for examining the relationship between personal experience, historical events, and forms of representation. This class will introduce students to the debates about the politics of memory and the artistic representation of the Holocaust, with special focus on public debates about the complex ways in which Holocaust memory surfaces in contemporary Germany and Austria, and by the accrual of layers of text and discourse about the Holocaust. We will explore the controversies and debates about public Holocaust memorialization in Germany, Austria, and the U.S. We will also explore the complex interplay between documentary and fictional accounts of the Holocaust, with attention paid to literary and film texts that challenge and ""remediate"" the limits of Holocaust representation. Additional topics will include Holocaust testimony; Holocaust memoirs, and 2nd and 3rd generation Holocaust literature, the Historians' Debate of the 1980s.

No knowledge of German required.","3","3","No","1","3","OPT - Student Option","-","Periodic Fall & Spring"
