"Course subject code","Course number","Course name","Campus","Course description","Minimum credits","Maximum credits","Is this course repeatable?","What is the maximum number of completions allowed?","What is the maximum number of credits that can be earned from this course?","Grading basis","Requirements","Typically offered term(s)"
"AFRO","3864","African American History: 1619 to 1865","Twin Cities","Importance of dynamics of class, gender, region, and political ideology. Changing nature of race/racism.","3","3","No","1","3","OPT - Student Option","-","Periodic Spring"
"AMES","3671","Hinduism and the Making of Modern India","Twin Cities","This course explores the role that Hinduism has played in Indian culture and politics the late 18th c. to the present, and the way that Hinduism itself has been transformed during this period.  In this course, we shall be guided by five overarching questions:
•	What are the key texts and everyday ritual practices of Hinduism, and how have these changed over the course of the last two centuries?  
•	What is the changing place of caste and especially the practice of untouchability in the understanding of what means to be a Hindu?  
•	What role do concerns about the role of women play in the religious reform movements and the emergence of new Hindu identities? 
•	What is the political role played by visions of Hinduism at and in different historical developments?  
By weaving together an analytical narrative centered around these four questions, we shall trace the remaking of Hinduism as a modern religion—one that wrestles with questions around nationalism, the public-private divide, the meaning of worship in a secular society, the relation with other religions, and equality of co-religionists.   ","3","3","No","1","3","OPT - Student Option","-","Periodic Fall & Spring"
"AMST","1012","Migrants, Refugees, Citizens, and Exiles: The U.S. on an Immigrant Planet","Twin Cities","Immigration to the United States at various historical periods and across geographical/political terrains. How immigration, as a national/racial project, is shaped by legal categories and discursive practices based on race, class, gender, and sexuality. Diverse ways marginalized groups produce national/transnational political practices.","3","3","No","1","3","OPT - Student Option","-","Every Spring"
"AMST","2011","The United States since September 11","Twin Cities","How American citizenship and nationhood have changed since 9/11. The event and its aftermath in historical perspective. Political, economic, and military antecedents. How 9/11 has changed relations between the U.S. government, U.S. citizens, immigrants, and international community. How 9/11 has been remembered.","3","3","No","1","3","OPT - Student Option","-","Every Fall"
"ANSC","1011","Animals and Society","Twin Cities","This online course is designed for anyone interested in the ways in which we as a human society interact with, affect and are affected by non-human animals. Students will gain a broad understanding of the major ways in which humans use animals in contemporary society, including as food, as companions, as research subjects, and as entertainment. Other topics will include: social and ethical issues concerning animal use, the human-animal bond, animals in culture, and animals and the law.","3","3","No","1","3","OPT - Student Option","-","Every Spring"
"ARTS","1002","Art and Life: Thinking About Ethics Through Art","Twin Cities","Case examples from visual arts. Ethical theories. Philosophical take on relationship between art, life, ethics. ","3","3","No","1","3","OPT - Student Option","-","Every Fall & Spring"
"BA","2005","Business Ethics, Corporate Responsibility & Sustainability","Twin Cities","This course seeks to give you the vocabulary necessary to describe and explain the ethical issues you will learn to identify through lectures, readings, and case studies. It will provide you with a decision-making framework that you can use to disentangle the most complicated scenarios, which will then allow you to use critical thinking and analysis to arrive at a decision on how you would respond as an individual in an ethically-defensible manner. This course will also anticipate your future career growth into positions of management and leadership, and will help give you the tools to manage people, money, and business affairs both effectively and ethically. 
BA 2005 was previously offered as Mgmt 1005","3","3","No","1","3","A-F - A-F Grade Basis","000011","Every Fall & Spring"
"BA","2005H","Business Ethics, Corporate Responsibility and Sustainability","Twin Cities","This course seeks to give you the vocabulary necessary to describe and explain the ethical issues you will learn to identify through lectures, readings, and case studies. You will be provided with a decision-making framework that you can use to disentangle the most complicated scenarios, which will then allow you to use critical thinking and analysis to arrive at a decision on how you would respond as an individual in an ethically-defensible manner. This course will also anticipate your future career growth into positions of management and leadership, and will help give you the tools to manage people, money, and business affairs both effectively and ethically. BA2005H was previously offered as MGMT1005H 

prereq: Honors student","3","3","No","1","3","A-F - A-F Grade Basis","000571","Every Spring"
"BIOL","1012","Human Biology: Concepts and Current Ethical Issues","Twin Cities","One semester exploration of human anatomy and physiology within the context of ethics; topics such as human genetic diversity, organs and tissues, disease and reproduction. Weekly policy debates.  Active learning format. Animal dissections required. Suitable for students in any major. Must be taken in addition to BIOL 1009 to fulfill prerequisites for allied health grad programs.

This course explores several interdisciplinary questions, each of which addresses biology through an ethical and societal lens.  In “What makes humans unique?”, we will consider the evolution of human traits, how the concept of race relates to human genetic diversity, and the fallibility of human memories.  In “How does blood and organ donation work?”, we will examine how our bodies can recognize and respond to foreign materials, how vaccines work, and who should have access to life saving tissue and organ transplants.  In “How do stress, diet and exercise affect health?” ,we will consider disparities in access to adequate nutrition, exposure to stress, and exercise, and how these affect our bodies and our mental health.  Lastly, in “How does a unique individual develop from a single cell”, we will examine how a single cell develops into a fully functional human being, and how similar processes lead to cancer. We will also consider the role of genes and hormones in human reproduction and the development of reproductive structures in embryos, while explicitly addressing the ethics of the distinctions between the concepts of sex characteristics, sex assigned at birth, and gender. We will learn how a cell can become cancerous, as well as how a cell develops into a fully functioning human being.  Additionally, we will consider the role of hormones in the development of male, female, and intersex organs, while being explicit about the differences between gender, sexual orientation, and sex assigned at birth.  

In lecture, instructors and teaching assistants will support students as they evaluate data and work through concepts in teams. Students will also dedicate significant time to the consideration of ethical questions in human biology, and work with teammates to organize and present a position on a policy related to an ethics question. In lab, students will further explore human anatomy and physiology, connecting structure and function through several dissections and activities. Students will read and share scientific papers, make observations, design experiments and analyze data.  Students will work in teams to complete a multi-week project on the physiology of stress. We will continue our exploration of ethics topics in lab, where we will discuss and apply ethics in human subjects research and research on non-human animals.  

About ⅓ of the course grade will be based on four traditional lecture exams and a final lab exam. The remainder of the course grade is comprised of open notes quizzes, in class team assignments, individual assignments, and team projects. Course grading is based on mastery of concepts and skills, and students are encouraged to collaborate in understanding course material.","4","4","No","1","4","OPT - Student Option","-","Every Fall & Spring"
"BIOL","1101","Genetics and Society","Twin Cities","Principles of heredity and their social and cultural implications.

prereq: Credit will not be granted if credit has been received for: BIOL 3020, Biol 4003, GCD 3022. No CBS Major Juniors or Seniors.","3","3","No","1","3","OPT - Student Option","-","Every Spring"
"BIOL","3209","Understanding the Evolution-Creationism Controversy","Twin Cities","Aspects of evolution-creationism controversy, including its history, legacy, relevance, and key people. Court decisions, public opinion, and related issues (e.g., racism, politics).

prereq: BIOL 1001, 1009, 1951 or 2002, or equiv","3","3","No","1","3","A-F - A-F Grade Basis","-","Every Fall & Spring"
"CHIC","1275","Engaged Learning in the Chicano/Latino Community","Twin Cities","This course considers the ways service-learning in Chicano and Latino communities can serve as a catalyst for promoting racial justice in education. By drawing attention to the ethical concept of relational being, through which individual humanity is both grasped and sustained, students will reflect on their ethical responsibilities to analyze and change U.S. educational systems. Students will investigate institutional and social constraints on equitable educational opportunities for Chicano/Latino students by exploring models for decolonizing education through civic action.

To fulfill the service-learning component of this course, (outside of class time) students will tutor and mentor Chicanos/Latinos at El Colegio or Academia Cesar Chavez as well as dialogue with Chicano/Latino educators and advocates. Generally, students will work 2-3 hours per week with one of these two partners. In this way, “service-learning” means that the course is experiential, using discussion and hands-on activities to deliver course material and achieve student learning outcomes. Education takes place in multiple social settings, particularly in the community, and thus, outside of the classroom. ","3","3","No","1","3","A-F - A-F Grade Basis","-","Periodic Fall"
"CHIC","3374","Migrant Farmworkers in the United States: Families, Work, and Advocacy","Twin Cities","Socioeconomic/political forces that impact migrant farmworkers. Effects of the laws and policies on everyday life. Theoretical assumptions/strategies of unions and advocacy groups. Role/power of consumer. How consuming cheap food occurs at expense of farmworkers.","4","4","No","1","4","OPT - Student Option","-","Every Spring"
"CHIC","4275","Theory in Action: Community Engagement in a Social Justice Framework","Twin Cities","Theoretical frameworks of social justice and community engagement for work outside classroom with/in Latina/o community. Worker issues/organizing. Placements in unions, worker organizations. Policy initiatives on labor issues. Students reflect on their own identity development, social location, and position of power/privilege. ","3","3","No","1","3","OPT - Student Option","-","Every Fall"
"CHIC","5374","Migrant Farmworkers in the United States: Families, Work, and Advocacy","Twin Cities","Socioeconomic/political forces that impact migrant farmworkers. Effects of the laws and policies on everyday life. Theoretical assumptions/strategies of unions and advocacy groups. Role/power of consumer. How consuming cheap food occurs at expense of farmworkers.","4","4","No","1","4","OPT - Student Option","001186","Every Spring"
"CNRC","3061","""Bread and Circuses:"" Spectacles and Mass Culture in Antiquity","Twin Cities","Development of large-scale public entertainments in ancient Mediterranean world, from athletic contests of Olympia and dramatic festivals of Athens to chariot races and gladiatorial games of Roman Empire. Wider significance of these spectacles in their impact on political, social, and economic life of the societies that supported them.","3","3","No","1","3","OPT - Student Option","-","Fall Odd, Spring Even Year"
"COMM","1101","Introduction to Public Speaking","Twin Cities","Public communication processes, elements, and ethics. Criticism of and response to public discourse. Practice in individual speaking designed to encourage civic participation. ","3","3","No","1","3","OPN - Student Option No Audit","-","Every Fall, Spring & Summer"
"COMM","1101H","Honors: Introduction to Public Speaking","Twin Cities","Public communication processes, elements, and ethics. Criticism of and response to public discourse. Practice in individual speaking designed to encourage civic participation.

prereq: Honors","3","3","No","1","3","A-F - A-F Grade Basis","000571","Every Fall & Spring"
"COMM","3631","Freedom of Speech","Twin Cities","Communication theories and principles that underlie the concept of freedom of speech in the United States.  A variety of contexts and practices are examined in order to understand how communicative interaction should be described and, when necessary, appropriately regulated.","3","3","No","1","3","OPT - Student Option","-","Every Fall, Spring & Summer"
"CPSY","1334","Global Issues on Children and Youth in Society","Twin Cities","Study of hot topics currently faced by children and youth around the world, including focuses on homelessness, acculturation, mental health, substance abuse, war and political violence, immigration, and legal issues. Provides an introduction to science, ethics, and ramifications in civic life of current, controversial issues concerning child or youth development. Examines topics of concern and interest to parents, society, and young people and how developmental science informs these issues and policies as well as the decisions and actions of citizens. Students will also learn how research is translated and disseminated so that it can inform policy and practice.","3","3","No","1","3","OPT - Student Option","-","Every Fall"
"CSCL","3221","On Television","Twin Cities","We will study writings on television and specific TV shows from a variety of angles to understand the rise of American broadcast technologies, how race and class are crafted on TV, representations of gender and the home, postmodernity and late capitalism, the rise and demise and of taste, global television and the public sphere, the production of “reality” in our present historical moment, and changes in televisual technologies. Throughout the course, we will also consider what constitutes television—the technology, the form, and the content—and learn to read these three facets of it concurrently.","3","3","No","1","3","OPT - Student Option","-","Every Fall & Spring"
"ENGL","3071","The American Food Revolution in Literature and Television","Twin Cities","America's relationship with food and eating has changed profoundly over the last fifty years. At the heart of this revolution was a group of charismatic personalities who through writing and television brought first European and then global sensibilities to the American table. They persuaded Americans that food and cooking were not just about nutrition but also forms of pleasure, entertainment, and art; ways of exploring other cultures; and means of declaring, discovering, or creating identity. Their work would eventually transform the American landscape, helping give rise to the organic movement, farmers markets, locavorism, and American cuisine, as well as celebrity chefs, the Food Network, and restaurant reality television. In the meantime, the environmental movement was sending its own shockwaves through American consciousness of food production and consumption. The joining together of these movements--culinary and environmental--has brought a new ethical dimension to the subject that is now at the forefront of current concerns about American food. Insofar as we eat, we necessarily make choices that have profound implications for our health, our communities, the environment, and those who work in the food industry, broadly defined. This class will trace the American food revolution with the intent of understanding how our current system came to be and thinking through the ethical implications of our daily actions. We will read classic literature from the rise of the movement, in varying degrees instructional, personal and documentary, while viewing some seminal television moments for the food culture we now know. We will give particular attention to recent work that focuses on the personal and environmental ethics of food.","3","3","No","1","3","OPT - Student Option","-","Every Fall"
"ENGL","3502","Nature Stories: Environmental Discourse in Action","Twin Cities","Explore contemporary texts from multiple disciplines to analyze the role of stories in interpreting nature. Emphasis on lived experience, civic motivation, and observational research that enrich effective nature writing. Optional service-learning component.","4","4","No","1","4","OPT - Student Option","-","Every Fall"
"ENGL","3506","Social Movements & Community Education","Twin Cities","In this course, we'll examine four progressive social movements. After beginning with a foundational civil rights movement example, we will learn about the anti-racist feminism branch of the women's movement, often referred to as ""third-wave feminism."" We'll also study the Occupy movement that arose in response to the Great Recession (the financial crisis beginning in 2008). Then we'll take a look at two social movements that, while by no means underground, tend to fly below the radar: the prison abolition movement and the fight for public schools. While all of these social movements have different emphases, they also overlap quite a bit in their systemic analysis of society and their strategies for action. As activist, organizer, and trainer Rinku Sen observes, ""the history of community organizing and social movements is replete with tactics learned in one movement being applied to another.""

As we study these social movements, community organizing will be of particular interest to us. How do the groups, collectives, nonprofits, and communities propelling these different social movements organize themselves, their leadership, their strategies, and their activities? How do they make decisions? What do meetings and planning processes look like? What do they do when they disagree? How do they recruit and mobilize? How do they communicate with and confront the general public, elected officials, and the more powerful elements of the ruling class? How do they talk about the work they're doing?  How do they develop a vision of the world they'd like to live in while still inhabiting the present one, with all its flaws and injustices? We'll also examine the role of education in organizations working for social change. Whether through trainings, ""political education,"" reading groups, or small group activities associated with popular education, many of the social-movement groups we'll study have developed educational strategies and curricula.  

Hands-On Learning through Community Education: As we study these social movements and their approaches to organizing and educating in the comfortable confines of our university classroom, we'll also learn about them experientially through our service-learning. That is, we'll work 2 hours per week at local education initiatives in K-12 schools, adult programs, and social-justice organizations in the non-profit and grassroots sectors, comprising a total of 24 hours by the end of the semester. This hands-on learning will strengthen our academic grasp of social movements, organizational dynamics, and teaching and community organizing by providing us with grounded perspectives. More broadly, we'll get a feel for what it's like to get involved as citizens, activists, teachers, and learners attempting to build cross-organizational coalitions. And we'll share what we learn with each other.

Representatives from the Center for Community-Engaged Learning (the U's service-learning office) and various community organizations will attend our second class session to tell you about their respective sites and how you can get involved. For our third class session, you will rank the top three community sites you'd like to work at. You will then be ""matched"" with a community organization, and your community education work will begin as soon as this matching process is complete. (We try to honor students' first and second choices, while also making sure that you also have some fellow classmates at your site.) To help prepare you, at a time convenient for you, you will also attend a training session facilitated by the Minnesota Literacy Council (MLC) or the Center for Community-Engaged Learning-- details will be provided in class.  
","4","4","No","1","4","A-F - A-F Grade Basis","-","Every Spring"
"ENGL","4233","Modern and Contemporary Drama","Twin Cities","Why did the polite Danish homes of 1879 bar discussions of Henrik Ibsen’s A Doll’s House? How did Oscar Wilde surreptitiously signal his sexuality through a satire of Victorian seriousness in The Importance of Being Earnest? How do contemporary playwrights such as August Wilson or Lynn Nottage bring forgotten moments of African American history to light? This course shows how modern and contemporary theater presents original perspectives on human identities and relationships as well as encourages audiences to see the world in new ways. This course focuses on the close analysis and interpretation of plays written by dramatists from around the world from the late-nineteenth to the twenty-first century. The plays we will study are set in Europe, Great Britain, North America, Africa, and Asia, and we will examine each carefully in light of the unique historical and social contexts in which they were produced, their creation and uses of aesthetic form, and their impact on individuals and communities.

Through the course, you will become familiar with such dramatic forms as the well-made play, modern satire, realism, expressionism, symbolism, epic theater, and absurdism. Each of these is interesting not only as a distinctive mode of artistic  presentation, but also as it offers different perspectives on historical moments and present-day concerns about people and their communities. Theatrical works illustrate how the meanings ascribed to physical bodies are at the heart of social differences such as gender, sexuality, class, race, disability, and national identity. We will look at each play in its original cultural context as well as through the creative lens of more recent productions and assess how both historical and more recent reimagining changes the meaning of the work. We will also make use of the rich theatrical resources and cultural organizations available in communities such as the Twin Cities.
","3","3","No","1","3","AFV - A-F or Audit","-","Periodic Fall & Spring"
"ENT","1001","How Insects Shape Society: Pollinators, Pests, and Policy","Twin Cities","Do you eat genetically modified foods, or do you avoid them? Vaccinate, or do not vaccinate? Did you know these are in part insect related questions? Insects make up more than half of the living organisms on this planet, and they have had a profound impact in shaping human society and culture. Even so, insects are swatted, stomped, squished, and otherwise misunderstood. In this course students will explore the complex, and often uncomfortable, relationships between insects and humans and explore the ethical dilemmas posed by our close relationships with the insect world. Ultimately this course examines the interactions between insects and humans, focusing on contemporary topics that explore how insects dictate human actions, policies, and behaviors. Topics include: human perception of insects; basic concepts in insect biology and behavior; environmental and cultural importance of insects; the role of insect pests in determining human food choice; insect vectors and disease transmission; perception and awareness about humanity’s role in nature.","3","3","No","1","3","A-F - A-F Grade Basis","-","Every Fall"
"ESPM","3271","Environmental Policy, Law, and Human Behavior","Twin Cities","What is necessary to achieve sustainable societies. What influences societal deliberation/decisions about environmental issues. How our behaviors affect natural systems. Key theoretical concepts of environmental social psychology and political science. How people respond to policies, using theoretical concepts from social psychology about attitudes, values, and social norms; applying these ideas to specific environmental problems and ethical debates.","3","3","No","1","3","AFV - A-F or Audit","-","Every Fall"
