"HIST","3418","Drink in History","Twin Cities","Significance of alcohol and stimulating beverages. Interdisciplinary study of alcohol/prohibition regimes throughout history.","3","3","No","1","3","OPT - Student Option","-","Fall Even, Spring Odd Year"
"HIST","3426","Piracy in the Mediterranean: The World of Merchants and Pirates","Twin Cities","This course will use the vehicle of piracy and privateering in the Mediterranean world to explore issues of cross-cultural interaction, global connections, and identity from earliest times when people took to the sea to the Middle Ages through the early modern era, 500-1800. Wherever there was trade, wherever there was movement on the seas, there was piracy. Recent scholarship on the Mediterranean has focused on connectivities, micro-environments, the uniqueness of islands, and various climatic spheres in a geographic tradition that follows the path-breaking work of Fernand Braudel. This course will consider the urban and rural dimensions of the Mediterranean region as they relate to the history of merchants and pirates. Finally, the political and military aspects of Mediterranean history will be examined. There was a continuum from piracy to privateering to war. Students should gain a deeper understanding of a region that continues to fascinate us today.","3","3","No","1","3","OPN - Student Option No Audit","-","Spring Odd Year"
"HIST","3431","Early Africa and Its Global Connections","Twin Cities","Survey of African history from earliest times to 1800. Focuses on socioeconomic, political, and cultural development in pre-colonial Africa from ancient Egypt through the era of the trans-Atlantic slave trade.","3","3","No","1","3","OPT - Student Option","-","Every Fall & Spring"
"HIST","3432","Modern Africa in a Changing World","Twin Cities","Survey of modern African history from early 19th century to present. Focuses on socioeconomic, political, and cultural development in Africa, from abolition of trans-Atlantic slave trade through postcolonial era.","3","4","No","1","4","OPT - Student Option","-","Every Fall, Spring & Summer"
"HIST","3433","Images of Africa","Twin Cities","Major themes in African history, from early human development to present.  History of western ""knowledge"" about Africa. Assumptions that have influenced production of African history. Extent to which African history is ""packaged"" for public consumption inside/outside Africa. How history is used to support modern political agendas.","3","3","No","1","3","OPT - Student Option","-","Periodic Fall & Spring"
"HIST","3435","History of South Africa from 1910: Anti-Racism, Youth Politics, Pandemics & Gender (Based Violence)","Twin Cities","We are all living in extraordinary times. But what does that mean? In South Africa, we have seen the COVID-19 pandemic and the measures implemented to control it causing massive social upheaval and personal distress. It has forced the people in the country to confront issues that life prior to the pandemic had made easy to turn away from. Misogyny, gender based violence and sexual violence – a long-standing emergency in the south of Africa – have been forced into our vision once again. It was not the pandemic that created this violence. Nor was it the first time people had been outraged by a lack of action to address it. In the years approaching 2020, calls, protests and demonstrations were increasingly demanding the culture of impunity in gender based violence be ended; sometime with violent outcomes against the protestors themselves. Over those same years, nationwide protests have rocked South Africa’s university campuses. The student movements known as #RhodesMustFall, #FeesMustFall and #RUReferenceList highlight the contrasts and disappointments of the recent past in South Africa, confront the legacy of racism and misogyny in its institutions and knowledge systems, and resonate with a history of anti-racism and struggle that now, in turn, similarly fuel the on-going Black Lives Matter and #MeToo movements worldwide.","3","3","No","1","3","OPT - Student Option","-","Periodic Fall"
"HIST","3444","Chicana and Chicano History I","Twin Cities","Experiences of people of Mexican descent in the United States. Important eras in histories of Mexico, the United States, and Mexican Americans. Central role of Chicana/os in U.S. history, culture, and politics. Topics include race, ethnicity, gender, sexuality, immigration, migration.","3","3","No","1","3","OPT - Student Option","-","Every Fall"
"HIST","3446","Chicana and Chicano History II: WWII, El Movimiento, and the New Millennium","Twin Cities","Experiences of people of Mexican descent in U.S. Notions of citizenship from WWII. Chicano civil rights movement. Impact of immigration patterns/legislation. Cultural wars, demographics. Social, economic, political changes. Meaning of racialized ""Mexican"" identity. How different groups of Mexicans have understood their relationships to other Americans/other Latino groups.","3","3","No","1","3","OPT - Student Option","-","Every Spring"
"HIST","3456","Social and Intellectual Movements in the African Diaspora","Twin Cities","Political, cultural, historical linkages between Africans, African-Americans, African-Caribbeans. Socio-political movements/radical intellectual trends in late 19th/20th centuries within African Diaspora. Resistance in Suriname, Guyana, Caribbean. Protest organizations, intellectual discourses, radical movements in United States/Europe.","3","3","No","1","3","OPT - Student Option","-","Every Fall"
"HIST","3462","From Subjects to Citizens: The History of East Asia From 1500 to the Present","Twin Cities","How Asian states, societies, economies, and cultures linked with one another and with European powers. How period's historical effects still resonate. Covers India, China, Japan, Korea, and Indochina.","3","4","No","1","4","OPT - Student Option","-","Every Spring"
"HIST","3466","Religion and Society in Imperial China","Twin Cities","Varieties of religious experience in imperial China. Religion as lived practices. Textual traditions. Buddhism, Daoism, Confucianism, relations among them. Western missionary enterprise in China.","3","3","No","1","3","OPT - Student Option","-","Periodic Fall & Spring"
"HIST","3471","Modern Japan, Meiji to the Present (1868-2000)","Twin Cities","Japan's early development as industrial/imperial power after Meiji Restoration of 1868. Political developments in Taisho years: social, cultural, economic trends that supported them. Militarization/mobilization for war in 1930s. Japan's war with China, Pacific War with the United States. American Occupation. Postwar economic recovery, high growth. Changing political/popular culture of 1980s, '90s.","3","3","No","1","3","OPT - Student Option","-","Every Fall & Spring"
"HIST","3511","Muslims and Jews: Conflict and Co-existence in the Middle East and North Africa since 1700","Twin Cities","Diversity of social/cultural interactions between Muslims and Jews and between Islam and Judaism since 1700. What enabled the two religious communities to peacefully coexist? What were causes of conflict? Why is history of Muslim-Jewish relations such a contested issue? ","3","3","No","1","3","OPT - Student Option","-","Fall Odd Year"
"HIST","3534","Introduction to Jewish History and Cultures","Twin Cities","This course traces the development of Judaism and Jewish civilizations from their beginnings to the present. With over three millennia as its subject, the course must of necessity be a general survey. Together we will explore the mythic structures, significant documents, historical experiences, narratives, practices, beliefs, and worldviews of the Jewish people. The course begins by examining the roots of Judaism in the Hebrew Bible and the history of ancient Israel but quickly focuses on the creative forces that developed within Judaism as a national narrative confronted the forces of history, especially in the forms of the Persian, Greek, and Roman empires.  Rabbinic Judaism becomes the most dominant creative force and will receive our greatest attention, both in its formative years and as it encounters the rise of Christianity and Islam. After studying the Jewish experience in the medieval world, we will turn to Judaism’s encounter with the enlightenment and modernity. The historical survey concludes by attending to the transformations within Judaism and Jewish life of the last 150 years, including a confrontation with the experience of the Holocaust. Woven throughout this historical survey will be repeated engagements with core questions: “Who is a Jew?” “What do Jews believe?” “What do Jews do?” “What do we mean by ‘religion’?”   “How do Jews read texts within their tradition?” And perhaps most importantly, “How many answers are there to a Jewish question?” Students in this course can expect to come away with some knowledge of the Bible in Judaism, rabbinic literature and law, Jewish mysticism and philosophy, Jewish nationalism and Zionism, Jewish culture, ritual, and worship in the synagogue, the home, and the community, and Jewish celebrations of life cycle events and the festivals.","3","3","No","1","3","OPT - Student Option","-","Every Fall"
"HIST","3547","The Ottoman Empire","Twin Cities","Survey of Islam's most successful empire, from its founding circa 1300 to its demise in 1923. Lands, institutions, peoples, historical legacy.","3","3","No","1","3","OPT - Student Option","-","Every Fall & Spring"
"HIST","3606","Christians, Muslims, and Jews in the Middle Ages","Twin Cities","A Pew Research survey of the global religious landscape in 2010 found 2.2 billion Christians (31.5% of the world?s population), 1.6 billion Muslims (23.2%), and 14 million Jews (.2%). In this class, we explore how the histories of these religious communities became deeply entangled in an age of diplomacy, trade, jihad, and crusade.","3","3","No","1","3","OPT - Student Option","-","Fall Even, Spring Odd Year"
"HIST","3611","Medieval Cities of Europe: 500-1500","Twin Cities","European cities changed from Roman times through the urban nadir of the Early Middle Ages to the flowering of cities in the High and Late Middle Ages.�We explore planned towns, ad hoc developments, revived Roman sites, and economic, political, cultural, and sensory elements of city life.�Students design a medieval city using Arc.GIS and StoryMap. Contact the instructor for more information.","3","3","No","1","3","OPN - Student Option No Audit","-","Every Fall & Spring"
"HIST","3613","History of the Crusades","Twin Cities","Crusading spirit in Europe. Results of classic medieval crusades ca 1095-1285. States established by crusaders in Near East. Internal European crusades. Chronological prolongation of crusading phenomenon.","3","3","No","1","3","OPT - Student Option","-","Every Fall, Spring & Summer"
"HIST","3616","The Hundred Years War: France and England in the Middle Ages","Twin Cities","Politics, society, and culture in medieval France from the end of the Carolingians to the end of the Hundred Years War.","3","3","No","1","3","OPN - Student Option No Audit","-","Periodic Fall"
"HIST","3617","Pagans, Christians, Barbarians: The World of Late Antiquity","Twin Cities","Between classical and medieval, pagan and Christian, Roman and barbarian, the late antique world was a dynamic age. This course will focus on the Mediterranean region from the 2nd to the mid-7th century exploring such topics as the conversion of Constantine, the fall of Rome, barbarian invasions, the spread of Christianity, and the rise of Islam.","3","3","No","1","3","AFV - A-F or Audit","-","Fall Odd Year"
"HIST","3706","Baroque Rome: Art and Politics in the Papal Capital","Twin Cities","This course explores the center of Baroque culture, Rome, as a city of spectacle and pageantry. The urban development of the city, as well as major works in painting, sculpture, and architecture, are considered within their political and religious context, with special emphasis on the ecclesiastical and private patrons who transformed the Eternal City into one of the world's great capitals. ","3","3","No","1","3","OPT - Student Option","-","Fall Odd Year"
"HIST","3713","The Age of Enlightenment:  European Art and Culture in the 18th Century","Twin Cities","“The Age of Enlightenment” is a 3-credit course intended to satisfy the Liberal Education Core requirement for the Historical Perspectives Core. Focusing on the transformations of the visual and plastic arts over the long 18th century (1680-1815), this course will introduce students to the seminal cultural shifts characteristic of the so-called European Enlightenment. Topics will include European travel and the Grand Tour; overseas colonial expansion, connectivity, and the globalization of Europe; secularization, materialism, libertinism, and the new morality; the Scientific Revolution and the creation of the modern scientific disciplines; the new public sphere and its mass, democratizing impulses; modern commercialism, capitalism and industrialization; and the percolation of new revolutionary political impulses.","3","3","No","1","3","OPT - Student Option","-","Periodic Fall"
"HIST","3722","Studies in 20th-Century Europe From the End of World War II to the End of the Cold War: 1945-91","Twin Cities","Social, economic, political, and cultural impacts of WWII upon Europe. Division of Europe. Communist regimes in Eastern Europe, cooperation in Western Europe. Impacts of modernization. End of Cold War.","3","3","No","1","3","OPT - Student Option","-","Every Fall, Spring & Summer"
"HIST","3746","Game of Thrones: Emperors, Knights and Witches in Central Europe","Twin Cities","This course traces the rise and fortunes of the Habsburg family from their emergence in the late 13th century to the end of the Holy Roman Empire in 1806. We use the family to explore key themes of the period including the Black Death, Hussite wars and peasant revolts, the new print culture, developments of the Reformation, European expansion and Enlightenment culture.

prereq: None","3","3","No","1","3","OPT - Student Option","-","Fall Odd, Spring Even Year"
"HIST","3749","Central and Eastern European Migrants in Minnesota","Twin Cities","In this class, we will use Minnesota, particularly the Twin Cities, as a lens through which to examine the history of Central and Eastern European migration to the United States (U.S.) from the late 19th century to the present. Moving chronologically and from the global to the local, this class will first examine the complex and intertwined reasons that prompted people to settle (either temporally or permanently) in the U.S. in the late 19th and early 20th centuries. We will explore the communalities and differences between the Poles, Ukrainians, Germans, Czechs, Slovaks, Jews, Hungarians, Slovenes, Croats, and Serbs who made up this initial wave of migration, and assess how these migrants shaped the urban and social fabric both in the United States, and in St. Paul and Minneapolis. Second, the class will examine how these communities evolved over the course in the 20th century by a) exploring topics such as ethnic identity maintenance, inter-generational relations, return migration, xenophobia and antisemitism, the relationship between migrants and the host society, and institutions (churches and synagogues, fraternal organizations, learned societies, archives, museums and libraries, etc.) established by migrants in the U.S., and b) assessing the impacts of later migration waves from Europe to the U.S., caused by the Holocaust and the Second World War, the 1956 Hungarian uprising, the 1968 Prague Spring, Soviet emigration policies, the fall of the Berlin Wall, and the civil wars in Yugoslavia. 

Keeping in mind the pressing ethical questions that subtend migration (both historical and contemporary), this class will also ask what it means to be a descendant of Central and Eastern European migrants in present-day Minnesota—not just of those who arrived over a century ago, but also more recent migrants, e.g., Russians, or Muslims from Bosnia-Hercegovina. To this end, we will enrich our classroom by extending it into the metro area with visits to relevant sites and meetings with representatives of some of these communities in order to understand their current lives, work, and challenges. This class will thus draw on numerous local resources: archives, buildings such as religious sites and community centers, museums, etc.","3","3","No","1","3","OPT - Student Option","-","Periodic Spring"
"HIST","3821","United States in the 20th Century to 1945","Twin Cities","American politics and society in the progressive era, the 1920's, the Great Depression and World War II. Economic reform at home, the challenges of world war abroad, and social change affecting the status of women and racial minorities.","3","3","No","1","3","OPT - Student Option","-","Every Fall, Spring & Summer"
"HIST","3848","The 1970s: Stayin’ Alive in the United States","Twin Cities","Stuck between the iconic 1960s and the flashy 1980s, the 1970s—for a long time by historians—were thought of as the decade where nothing happened. However, is that really the case? The 1970s have turned out to be an ever more important decade to examine, research, and think about. The previously declared “stagnant” decade has been the subject of newfound attention and together we will immerse ourselves in the music, politics, technology, and issues of the time to discover exactly how disco came to dominate the music charts, how people lost hope in the political system, how civil rights activists continued the quest for equality, and how folks did their best to stay alive in a very confusing decade.","3","3","No","1","3","A-F - A-F Grade Basis","-","Periodic Spring"
"HIST","3849","The Histories of Student Activism in the United States","Twin Cities","College students do a lot of things. They study. They are part of clubs, sports teams, and organizations. They work. They build lives outside the institution. They also protest and look for ways to change the world. This is a course that explores the many histories of student activism. Students have taken part in some of the most important social movements in the world. Students have also turned their attention inward to demand that the university change or expand in one way or another. In all of these ways, students are engaging in civic life and thinking through the ethics of many public problems.

Through a focus on the United States and particular attention paid to the University of Minnesota itself, students will think deeply about questions of activism and reflect on the actions of their direct historical counterparts. We will examine how various student groups debate ethics and make decisions about how to engage with the broader body politic. Throughout the semester we will be learning and discussing both how world events shape college students and how college students shape the world around them.","3","3","No","1","3","A-F - A-F Grade Basis","-","Periodic Spring"
"HIST","3852","Work and Workers in the United States","Twin Cities","Why do Americans work, and what do we expect in exchange? This course explores how the answers to those questions have changed overtime, from the colonial era to the present, and how the past shapes our approach to work today.","3","3","No","1","3","OPT - Student Option","-","Periodic Fall"
"HIST","3853","Black Protest in Twentieth Century America","Twin Cities","This course gets at the heart of why/how African Americans have been fighting for social and political equality throughout the 20th Century. We explore various ways that African Americans have articulated their political demands and affirmed their citizenship rights using youth and grassroots organizations, workers' rights, feminism, education, the courts and laws as tools for political advancement.","3","3","No","1","3","A-F - A-F Grade Basis","-","Periodic Fall, Spring & Summer"
"HIST","3854","Race and Sport","Twin Cities","This class examines how race, gender, and sport intersect as sites of resistance and reform in twentieth century American life. With the intensification of Jim Crow coinciding with the professionalization and commercialization of sports, athletes of color became central to American debates about science, citizenship, class, ethnicity, sexuality, social mobility, belonging, culture, and entitlement. This seminar will be particularly interested in how athletes of color forced a place for themselves in sports like baseball, boxing, football, golf, and basketball by exercising different models of political protest, citing an urgent need for social justice reforms that spread beyond the realm of sport.","3","3","No","1","3","A-F - A-F Grade Basis","-","Periodic Fall"
"HIST","3858","Policing, Surveillance, and Social Movements in 20th Century U.S.","Twin Cities","This course explores how policing and surveillance changed, evolved, and adapted throughout the twentieth century in the United States. We will trace the trajectory of police power & legitimacy as well as examine how the institution of policing responded to ongoing racial justice movements. ","3","3","No","1","3","A-F - A-F Grade Basis","-","Periodic Fall & Spring"
"HIST","3859","African Americans in Germany","Twin Cities","How have African Americans understood their experiences with race outside of the United States? African Americans have been migrating and circulating the globe since the American Revolution, and it is only recently that scholars have considered the ways in which an abroad experience has been transformative for African Americans. In this seminar-style class, we will explore why and how African Americans have used their experiences in Germany to express a new understanding of their identity in the United States.","3","3","No","1","3","OPT - Student Option","-","Fall Odd Year"
"HIST","3862","American Immigration History","Twin Cities","Global migrations to U.S. from Europe, Asia, Latin America, and Africa, from early 19nth century to present. Causes/cultures of migration. Migrant communities, work, and families. Xenophobia, assimilation/integration, citizenship, ethnicity, race relations. Debates over immigration. Place of immigration in America's national identity.","3","3","No","1","3","OPT - Student Option","-","Spring Odd Year"
"HIST","3864","African American History: 1619-1865","Twin Cities","Importance of dynamics of class, gender, region, and political ideology. Changing nature of race/racism.","3","3","No","1","3","AFV - A-F or Audit","-","Periodic Fall & Spring"
"HIST","3871","American Indian History: Pre-Contact to 1830","Twin Cities","Introduction to American Indian history from ancient native America to the removal era. Focuses on the social, cultural, political, and economic diversity of Native American peoples and Native American experiences with European colonialism.","3","3","No","1","3","OPT - Student Option","-","Every Fall & Spring"
"HIST","3872","American Indian History: 1830 to the Present","Twin Cities","Focus on the impact of federal Indian policy on American Indian cultures and societies, and on American Indian culture change.","3","3","No","1","3","OPT - Student Option","-","Every Fall & Spring"
"HIST","3877","Asian American History, 1850-Present","Twin Cities","Asian American history and contemporary issues, from 1850 to the present. Immigration, labor, anti-Asian movements, women/families, impact of World War Two, new immigrant/refugee communities, civil rights, Asian American identity/culture.","3","3","No","1","3","OPT - Student Option","-","Every Fall & Spring"
"HMED","3040","Human Health, Disease, and the Environment in History","Twin Cities","Introduction to historical relationship of human health and the environment. How natural/human-induced environmental changes have, over time, altered our experiences with disease and our prospects for health. ","3","3","No","1","3","OPT - Student Option","-","Every Spring & Summer"
"HMED","3055","Women, Health, and History","Twin Cities","Women's historical roles as healers, patients, research subjects, health activists. Biological determinism, reproduction, mental health, nursing, women physicians, public health reformers, alternative practitioners. Gender disparities in diagnosis, treatment, research, careers. Assignments allow students to explore individual interests.","3","3","No","1","3","A-F - A-F Grade Basis","-","Periodic Fall & Spring"
"HMED","3075","Technology and Medicine in Modern America","Twin Cities","How technology came to medicine's center-stage. Impact on production of medical knowledge, professionalization, development of institutions/industry, health policy, and gender/race disparities in health care.","3","3","No","1","3","OPT - Student Option","-","Every Fall & Spring"
"HMED","3345","Medicine, Health, and Diseases in East Asia","Twin Cities","This course explores the history of medicine in East Asia from the ancient period to the present day. From the globalization of acupuncture practices to the fight against the deadly SARS and COVID viruses, East and Southeast Asians in their homelands and abroad have sought to develop, transform, and disseminate their ways of healing.

We will critically examine classical Chinese medicine's persistence, transformation, and globalization in the region and beyond. Other topics covered include the role of Western medicine in East Asia, the contestation over vaccination and pharmaceuticals, the role of colonialism in shaping medical practices, and the imaginations of Asian medicine in the United States.","3","3","No","1","3","OPN - Student Option No Audit","-","Every Fall"
