"ESPM","3921","Science and Critical Thinking for Understanding Our World","Twin Cities","Today more than ever we must deal with multiple sources of conflicting information on topics that affect our lives in big ways.  We use this information to make important decisions, from major policy decisions to personal lifestyle choices. Understanding complex, high-stakes societal issues such as the global COVID-19 pandemic requires that we rapidly process and synthesize new science that is changing fast, and that we do so in an environment of partisan bias and media spin that make it extremely difficult for citizens to stay informed and make good decisions. The debate surrounding the response to COVID-19, climate change, water policy, and other planetary and human health issues, invoke moral or ethical principles in addition to scientific arguments. As a result, problem solving and decision making requires simultaneously evaluating complex scientific and ethical arguments. Several aspects of human psychology mean that we do not reliably make logical choices when presented with complex information. Furthermore, data and science are frequently used to mislead, from the naïve misuse of statistics to deliberate misinformation campaigns. As a result, weighing evidence and rational decision-making for complex issues requires skepticism, critical thinking, and lots of practice. 

In this course, students will develop critical thinking tools and cultivate scientific skepticism for evaluating claims encountered in peer-reviewed scientific papers, popular press articles, or on social media. Examples and case studies will draw heavily on current events surrounding the COVID-19 pandemic and associated societal and environmental responses,  but will also include other environmental, health, and public policy issues to demonstrate the range of ways in which data and science can be used or misused to support a position. To create the necessary habits of mind for skepticism and critical thinking, this course will cover background material from ethics, neurology, behavioral economics, statistics, and logic. We will employ a number of active learning strategies, and class meetings will frequently consist of students actively engaged in processing and understanding course content. 

Upon leaving this course students will be able to confidently evaluate the veracity of information as they encounter it in multiple contexts throughout their lives. Students will understand how views of the role of ethics in scientific inquiry have evolved, and the roles of science, uncertainty, and ethics in determining public opinion and policy decisions on environmental topics. Students will learn to identify and recognize misinformation in its various forms and to articulate why a particular piece of information is misleading. We will explore the various ways that our intuition and memory make interpreting data and statistics challenging, and develop tools and habits of mind to overcome these challenges.","3","3","No","1","3","A-F - A-F Grade Basis","-","Every Fall"
"FREN","3632","Revolution and Human Rights: The French Revolution and its Legacy","Twin Cities","What role did the French Revolution play in shaping how we think about the possibility of massive social change, justice, and rights today? How especially did 18th-century philosophy, culture, politics, and economics influence the development of what we call universal individual ""human rights."" We also ask: could we have done better?  To do so, we will play ""Rousseau, Burke, and Revolution in France, 1791,"" a Reacting to the Past flipped-classroom role-playing game. Working individually and in teams, students will prepare speeches, produce pamphlets and newspapers, not only to learn about the stakes of this historical turning point and the philosophical debates surrounding it, but also to imagine changing it. We will also seek out and document the legacy of this Revolution in our lives and around the world today.  This class offers students the knowledge and skills to participate in substantive debate aimed at solving problems collectively, to effect change aligning with their beliefs and philosophies, and to reflect critically on historical legacy.

prereq Fren 3015; Fren 3016 recommended","3","3","No","1","3","OPT - Student Option","-","Spring Even Year"
"FREN","3732","Revolution and Human Rights: The French Revolution and its Legacy","Twin Cities"," What role did the French Revolution play in shaping how we think about the possibility of massive social change, justice, and rights today? How especially did 18th-century philosophy, culture, politics, and economics influence the development of what we call universal individual ""human rights."" We also ask: could we have done better?  To do so, we will play ""Rousseau, Burke, and Revolution in France, 1791,"" a Reacting to the Past flipped-classroom role-playing game. Working individually and in teams, students will prepare speeches, produce pamphlets and newspapers, not only to learn about the stakes of this historical turning point and the philosophical debates surrounding it, but also to imagine changing it. We will also seek out and document the legacy of this Revolution in our lives and around the world today.  This class offers students the knowledge and skills to participate in substantive debate aimed at solving problems collectively, to effect change aligning with their beliefs and philosophies, and to reflect critically on historical legacy

No prerequisites. All materials for Fren 3732 are in English, and students in all programs are welcome! ","3","3","No","1","3","OPT - Student Option","-","Spring Even Year"
"FRIT","3656","Existentialism","Twin Cities","What do we mean when we call something ""existential?""  What do we mean when we speak of an ""existential"" crisis? We seem to mean that our core beliefs and assumptions are affected and the relationship with our environment is ruptured; we have fallen out of normalcy. The term existentialism -- turning existential into a noun -- came into being in the 1940s in France, reflecting the collective experience of societal breakdown, of Nazism, and WW2. It has since been applied to all modes of philosophical inquiry that take an individual's experience of alienation from society as their point of departure. The advantage of making alienation the focus of this class, too, is that it allows us to recognize the precise historical and sociological index of the emergence of an existentialist mode of thought and practice. Existentialism looks very different when it responds to a 19th century crisis of faith (Søren Kierkegaard), to 1950s colonialism (Frantz Fanon), to Weimar Germany's new democracy and the specter of a mass society (Martin Heidegger), or to the neo-authoritarian French society of the 1960s (Simone de Beauvoir). Existentialism then is understood in this class not as a conversation between great thinkers or ideas across time and space, but as a response to a specific crisis of norms and values. It only exists in plural. If existentialist concepts -- like being-in-the world, being-towards-death, or the gaze of the other -- are carried forward, then not without being repurposed. Such situatedness is inherent to existentialism itself. Accordingly, existentialist writers have no creed or ethical stance in common; they are found both on the far (fascist) right and on the Marxist left. They do share though a keen interest in a new language and in literary forms of expression and subsequently, they insist on the individuals' capacity of ""world-making"" -- in rupture and rebellion -- against seemingly compromised societal norms.","3","3","No","1","3","OPT - Student Option","-","Spring Even Year"
"FSCN","1013","Dietary Supplements: scientific, regulatory, and cultural aspects","Twin Cities","Dietary supplements are commonplace in modern life, especially in the United States, furthermore the dietary supplement industry is a multi billion dollar industry with relatively little government oversight and regulation. Many factors have spurred the use of dietary supplements such as changes in dietary patterns, growing focus on preventative healthcare, marketing & social media (e.g., celebrity and athletic endorsements & consumer anecdotes), and increased accessibility through e-commerce, but there has been little philosophical work on the ethical issues surrounding these. This course is designed to encourage students to critically examine and reflect on these factors as well as dietary supplement use across cultures and the appropriation of traditional medicines and knowledge for commercial gains. Students will also evaluate information on dietary supplements for performance, strength, weight loss, and the treatment of diseases or delay of disease onset and assess the ethical decision making related to the marketing and use of supplements for these purposes.","3","3","No","1","3","OPT - Student Option","-","Every Spring"
"FSCN","1102","Food: Safety, Risks, and Technology","Twin Cities","Introduction to inherent risks/safety of food supply. Use of public policy and food technology to reduce risks. Microbiological, chemical, and environmental hazards, government/industry controls.","3","3","No","1","3","OPN - Student Option No Audit","-","Every Fall & Spring"
"FSOS","1461","Presentations at Work: Families, Communities, Nonprofits, and Schools","Twin Cities","This course prepares students to present information and adjust their messages based on audience need in a variety of future work contexts. Students interested in majoring in Family Social Science, Education, Youth Studies, and Kinesiology will take this course in order to develop the disciplinary practices used in counseling, community-based organizations, education, and health sciences to convey important, and often sensitive, material to specific audiences.","3","3","No","1","3","AFV - A-F or Audit","-","Every Spring"
"GCC","3025","Seeking the Good Life at the End of the World: Sustainability in the 21st Century","Twin Cities","What does it mean to live ""the good life"" in a time of rapid climate changes, mass extinction of plant and animal species, and the increasing pollution of our oceans, atmosphere, and soils? Is it possible to live sustainably, as individuals and societies, in what scientists are calling the Anthropocene, or this new epoch of human influence over the planet? Will sustainability require that we sacrifice the gains humanity has made in our quality of life? Or can we find a way to create a good Anthropocene? This course will attempt to answer these questions in four ways:
1. By providing an overview of sustainability science, both what it says about about human and natural systems and how it comes to make these claims
2. By examining various conceptions of the good life, both individual and social, and how they intersect with the findings of sustainability science 
3. By exploring the conflicts that exist within and between differing visions of sustainability and the good life through case studies in energy, water, and food
4. By pursuing collaborative research projects that will help students apply their knowledge and skills to current problems in sustainability studies
We will read widely in the sciences, social sciences, and humanities to understand a range of historical and contemporary perspectives on these questions, and in doing so we will put abstract ethical principles into conversation with a diversity of specific cultures and environments. By the end of the course, students will have examined their own assumptions about personal and professional happiness, considered how these align with and diverge from societal visions and values, and explored innovative solutions to help sustain our productive economy and our planet.

This is a Grand Challenge Curriculum course.","3","3","No","1","3","A-F - A-F Grade Basis","000959","Periodic Fall & Spring"
"GCC","3029","Agents of Change: scientific and philosophical perspectives","Twin Cities","Grand challenges like structural racism, climate change, gender oppression, and global poverty have to be solved by individual people, acting together, often through institutions. This means that we need good agents of change to address the challenges we face.  What does it mean to be a ‘good agent’?  What are the best ways to think about this kind of agency? And how can we foster more of it in ourselves, our friends, our children, and our fellow citizens? 

This course is taught by a philosopher and a psychologist, and we approach questions like these from both perspectives. Traditionally, many philosophers have thought that we need to cultivate virtues such as compassion and open-mindedness in order to be good people. Some recent psychological work casts doubt on this picture: the social and environmental forces that influence our behavior cannot be overcome with virtuous character! On the other hand, psychological research also shows that some of the good traits we have are ones that develop reliably, from early childhood. Which perspective offers more opportunities for progress? Should we foster good agency by working on individual character or by changing social circumstances? Or, if both are important, what would a combined approach look like? 

The ultimate goal of the course is to encourage students to apply the theoretical and scientific ideas about improving agency to specific grand challenges. How do philosophy and psychology help us to define and resolve the challenges that confront people who want to make a difference? To provide a model for this kind of research, we focus on structural racism and white supremacy to expose the ways in which individual and structural forces can impede epistemic and moral agency. Course requirements include active class participation, group projects, and writing assignments designed to foster creative engagement across different fields.","3","3","No","1","3","A-F - A-F Grade Basis","000959","Periodic Spring"
"GCC","3031","The Global Climate Challenge: Creating an Empowered Movement for Change","Twin Cities","Students will explore ecological and human health consequences of climate change, the psychology of climate inaction, and will be invited to join us in the radical work of discovering not only their own leadership potential but that of others. We will unpack the old story of domination and hierarchy and invite the class to become part of a vibrant new story of human partnership that will not only help humanity deal with the physical threat of climate change but will help us create a world where we have the necessary skills and attitudes to engage the many other grand challenges facing us. Using a strategy of grassroots empowerment, the course will be organized to help us connect to the heart of what we really value; to understand the threat of climate change; to examine how we feel in the light of that threat; and to take powerful action together. Students will work in groups throughout the course to assess the global ecological threat posed by climate change, and they will be part of designing and executing an activity where they empower a community to take action. 

This is a Grand Challenge Curriculum course.
prereq: soph, jr, sr","3","3","No","1","3","A-F - A-F Grade Basis","000959","Periodic Spring"
"GCC","5029","Agents of Change: scientific and philosophical perspectives","Twin Cities","Grand challenges like structural racism, climate change, gender oppression, and global poverty have to be solved by individual people, acting together, often through institutions. This means that we need good agents of change to address the challenges we face.  What does it mean to be a ‘good agent’?  What are the best ways to think about this kind of agency? And how can we foster more of it in ourselves, our friends, our children, and our fellow citizens? 

This course is taught by a philosopher and a psychologist, and we approach questions like these from both perspectives. Traditionally, many philosophers have thought that we need to cultivate virtues such as compassion and open-mindedness in order to be good people. Some recent psychological work casts doubt on this picture: the social and environmental forces that influence our behavior cannot be overcome with virtuous character! On the other hand, psychological research also shows that some of the good traits we have are ones that develop reliably, from early childhood. Which perspective offers more opportunities for progress? Should we foster good agency by working on individual character or by changing social circumstances? Or, if both are important, what would a combined approach look like? 

The ultimate goal of the course is to encourage students to apply the theoretical and scientific ideas about improving agency to specific grand challenges. How do philosophy and psychology help us to define and resolve the challenges that confront people who want to make a difference? To provide a model for this kind of research, we focus on structural racism and white supremacy to expose the ways in which individual and structural forces can impede epistemic and moral agency. Course requirements include active class participation, group projects, and writing assignments designed to foster creative engagement across different fields.","3","3","No","1","3","A-F - A-F Grade Basis","000574","Every Fall"
"GCC","5031","The Global Climate Challenge: Creating an Empowered Movement for Change","Twin Cities","Students will explore ecological and human health consequences of climate change, the psychology of climate inaction, and will be invited to join us in the radical work of discovering not only their own leadership potential but that of others. We will unpack the old story of domination and hierarchy and invite the class to become part of a vibrant new story of human partnership that will not only help humanity deal with the physical threat of climate change but will help us create a world where we have the necessary skills and attitudes to engage the many other grand challenges facing us. Using a strategy of grassroots empowerment, the course will be organized to help us connect to the heart of what we really value; to understand the threat of climate change; to examine how we feel in the light of that threat; and to take powerful action together. Students will work in groups throughout the course to assess the global ecological threat posed by climate change, and they will be part of designing and executing an activity where they empower a community to take action. 

This is a Grand Challenge Curriculum course.
For: so, jr, sr, grad","3","3","No","1","3","A-F - A-F Grade Basis","000574","Periodic Spring"
"GEOG","3388","Going Places: Geographies of Travel and Tourism","Twin Cities","Are you wondering whether you will be able to travel as you did a few years ago? One of the largest industries, tourism, is in a profound crisis. This course understands tourism in relation to other kinds of mobility, like shopping, colonialism, trafficking, migration, and pilgrimage. As the negative environmental and health impacts of tourism have become obvious, significant demands have emerged on its practices and policies. Investigating the landscapes and economies of cars, planes, beaches, parks, malls, and museums, we come to appreciate the unique challenges tourism poses for global citizenship and the planet. To gain a critical geographical understanding of mobility, we engage a range of ethical frameworks such as human rights, feminism, social justice, and utilitarianism. Our final destination is an informed and critical ethics of travel in the age of pandemics and climate change.","3","3","No","1","3","OPT - Student Option","-","Every Spring"
"GER","3655","Cultures of Control and Surveillance in Germany and the US","Twin Cities","Discourses and practices of social control and surveillance in comparative/historical perspective. Explores the central conceptual condition for modern ethics: the relationship between individual and society. Paintings, manuals, scholarly and philosophical essays, and literary texts including writings by Franz Kafka.","3","3","No","1","3","OPT - Student Option","-","Fall Odd Year"
"GLOS","3143","Place, Community, Culture","Twin Cities","Students in the Global Studies program study not only the powerful political institutions and economic processes that shape our world, they also acquire the  skills to perceive and investigate their own place and identities, and to interpret creative work that express different ways of being. In GLOS 3143 'Place, Community, Culture' students will explore their own locations, identities, and experiences in the context of our fraught and ethically complex times. The emphasis is on practice, on seeing one's own life as something to be enriched by seeing and feeling the world in new ways. Students will encounter a mix of philosophical works, artistic texts (novels, films, poetry,  painting, music, and other forms of media) and scholarly texts that together will help students expand their ingrained and conditioned ways of seeing the world. Class themes might include self and other, community and alienation, place and placelessness, home and homelessness. Students will examine the place of ethics and politics in the negotiation of their identities and  experiences. Assignments might include essays that ask students to interpret  artistic works that present different avenues of insight, or creative assignments that ask you to reflect on your own experiences in relation to course readings and themes. Students will conclude the class more confident of their ability to notice and negotiate the dilemmas they will encounter in their personal and professional lives.","3","3","No","1","3","A-F - A-F Grade Basis","-","Every Spring"
"GLOS","3412","What is Equality?","Twin Cities","Course explores debates about equality. Equality has many dimensions--e.g.: economic, social, political. These forms cannot be reconciled. Liberal democracies affirm the principle of political equality but defend, even in principle, social and economic inequalities. Animal rights add another wrinkle: very few of those who fight for these rights would claim political equality for animals. ","3","3","No","1","3","A-F - A-F Grade Basis","-","Every Spring"
"GSD","3656","Existentialism","Twin Cities","What do we mean when we call something ""existential?""  What do we mean when we speak of an ""existential"" crisis? We seem to mean that our core beliefs and assumptions are affected and the relationship with our environment is ruptured; we have fallen out of normalcy. The term existentialism -- turning existential into a noun -- came into being in the 1940s in France, reflecting the collective experience of societal breakdown, of Nazism, and WW2. It has since been applied to all modes of philosophical inquiry that take an individual's experience of alienation from society as their point of departure. The advantage of making alienation the focus of this class, too, is that it allows us to recognize the precise historical and sociological index of the emergence of an existentialist mode of thought and practice. Existentialism looks very different when it responds to a 19th century crisis of faith (Søren Kierkegaard), to 1950s colonialism (Frantz Fanon), to Weimar Germany's new democracy and the specter of a mass society (Martin Heidegger), or to the neo-authoritarian French society of the 1960s (Simone de Beauvoir). Existentialism then is understood in this class not as a conversation between great thinkers or ideas across time and space, but as a response to a specific crisis of norms and values. It only exists in plural. If existentialist concepts -- like being-in-the world, being-towards-death, or the gaze of the other -- are carried forward, then not without being repurposed. Such situatedness is inherent to existentialism itself. Accordingly, existentialist writers have no creed or ethical stance in common; they are found both on the far (fascist) right and on the Marxist left. They do share though a keen interest in a new language and in literary forms of expression and subsequently, they insist on the individuals' capacity of ""world-making"" -- in rupture and rebellion -- against seemingly compromised societal norms.","3","3","No","1","3","OPT - Student Option","-","Spring Even Year"
"GWSS","1005","Engaging Justice","Twin Cities","U.S./cross-cultural studies of social movements/political organizing around justice/equality.","3","3","No","1","3","OPT - Student Option","-","Fall Odd, Spring Even Year"
"GWSS","4002","Politics of Engagement and Social Justice","Twin Cities","Ways in which feminist scholars have thought about and worked to complicate the opposition between theory and praxis. Diverse efforts by intellectuals situated within the Western academy to produce scholarship that is committed to deinstitutionalizing knowledge production and relevant to political struggles confronted by their own material and institutional inequalities.","3","3","No","1","3","A-F - A-F Grade Basis","-","Fall Odd Year"
"HIST","1809","The Presidency: Power, Politics, and Policy in the United States","Twin Cities","This course explores the emergence, meaning, and evolution of the American presidency. We will examine the nature of presidential power and ask how and why those powers have changed over time. We will explore the impact of politics and political parties on the American presidency. We will consider how presidents shape policy and analyze the relationship between power, politics, and policy.","3","3","No","1","3","OPT - Student Option","-","Fall Even Year"
