"GEOG","3373","Changing Form of the City","Twin Cities","Urban origins, ancient cultures/cities, the medieval city, rediscovery of planning, colonial cities. Industrialization and urban expansion. Speculative cities, utopian cities, planning triumphs/disasters. Cities as reflections of society, culture, the past.","3","3","No","1","3","OPT - Student Option","-","Every Spring"
"GER","3633","The Holocaust: Memory, Narrative, History","Twin Cities","Decades after the end of the second world war, the Holocaust continues to play a formative role in public discourse about the past in Germany and Austria. As the event itself recedes into the past, our knowledge about the Holocaust has become increasingly shaped by literary and filmic representations of it. This course has several objectives: first, to deepen students' historical knowledge of the events and experiences of the Holocaust, and at the same time to introduce critical models for examining the relationship between personal experience, historical events, and forms of representation. This class will introduce students to the debates about the politics of memory and the artistic representation of the Holocaust, with special focus on public debates about the complex ways in which Holocaust memory surfaces in contemporary Germany and Austria, and by the accrual of layers of text and discourse about the Holocaust. We will explore the controversies and debates about public Holocaust memorialization in Germany, Austria, and the U.S. We will also explore the complex interplay between documentary and fictional accounts of the Holocaust, with attention paid to literary and film texts that challenge and ""remediate"" the limits of Holocaust representation. Additional topics will include Holocaust testimony; Holocaust memoirs, and 2nd and 3rd generation Holocaust literature, the Historians' Debate of the 1980s.

No knowledge of German required.","3","3","No","1","3","OPT - Student Option","-","Periodic Fall & Spring"
"GER","3655","Cultures of Control and Surveillance in Germany and the US","Twin Cities","Discourses and practices of social control and surveillance in comparative/historical perspective. Explores the central conceptual condition for modern ethics: the relationship between individual and society. Paintings, manuals, scholarly and philosophical essays, and literary texts including writings by Franz Kafka.","3","3","No","1","3","OPT - Student Option","-","Fall Odd Year"
"GER","3661","African Americans in Germany","Twin Cities","How have African Americans understood their experiences with race outside of the United States? African Americans have been migrating and circulating the globe since the American Revolution, and it is only recently that scholars have considered the ways in which an abroad experience has been transformative for African Americans. In this seminar-style class, we will explore why and how African Americans have used their experiences in Germany to express a new understanding of their identity in the United States.","3","3","No","1","3","OPT - Student Option","-","Fall Odd Year"
"GLBT","4101","Gender, Sexuality, and Politics in America","Twin Cities","Ways public and private life intersect through the issues of gender, sexuality, family, politics, and public life; ways in which racial, ethnic, and class divisions have been manifest in the political ideologies affecting private life.","3","3","No","1","3","OPT - Student Option","-","Every Fall"
"GSD","3656","Existentialism","Twin Cities","What do we mean when we call something ""existential?""  What do we mean when we speak of an ""existential"" crisis? We seem to mean that our core beliefs and assumptions are affected and the relationship with our environment is ruptured; we have fallen out of normalcy. The term existentialism -- turning existential into a noun -- came into being in the 1940s in France, reflecting the collective experience of societal breakdown, of Nazism, and WW2. It has since been applied to all modes of philosophical inquiry that take an individual's experience of alienation from society as their point of departure. The advantage of making alienation the focus of this class, too, is that it allows us to recognize the precise historical and sociological index of the emergence of an existentialist mode of thought and practice. Existentialism looks very different when it responds to a 19th century crisis of faith (Søren Kierkegaard), to 1950s colonialism (Frantz Fanon), to Weimar Germany's new democracy and the specter of a mass society (Martin Heidegger), or to the neo-authoritarian French society of the 1960s (Simone de Beauvoir). Existentialism then is understood in this class not as a conversation between great thinkers or ideas across time and space, but as a response to a specific crisis of norms and values. It only exists in plural. If existentialist concepts -- like being-in-the world, being-towards-death, or the gaze of the other -- are carried forward, then not without being repurposed. Such situatedness is inherent to existentialism itself. Accordingly, existentialist writers have no creed or ethical stance in common; they are found both on the far (fascist) right and on the Marxist left. They do share though a keen interest in a new language and in literary forms of expression and subsequently, they insist on the individuals' capacity of ""world-making"" -- in rupture and rebellion -- against seemingly compromised societal norms.","3","3","No","1","3","OPT - Student Option","-","Spring Even Year"
"GWSS","3549","U.S. Women's Legal History","Twin Cities","Women's legal status, from colonial era through 20th century. Women's citizenship, civil rights. Marriage, divorce, and child custody. Reproductive/physical autonomy/integrity. Economic/educational equality.

prereq: Soph or jr or sr","3","3","No","1","3","AFV - A-F or Audit","000595","Fall Odd Year"
"HIST","1082","Jesus in History, Art & Culture","Twin Cities","Does time, place, and culture affect our picture of Jesus? We'll start by constructing our own Jesus story and then go backwards in time to examine modern times (film, music, and modern art), pre-Civil War America (views of Jesus from enslaved people and their enslavers), Renaissance and Medieval Europe and North Africa (art and architecture), and finally end with the ancient world (art and writings about Jesus, including the biblical gospels). No background in religious studies required, and students of any, all, or no religious background are welcome.","3","3","No","1","3","OPT - Student Option","-","Every Spring"
"HIST","1307","Authority and Rebellion: American History to 1865","Twin Cities","Conflict/change, from colonial era through Civil War. Colonization/resistance, slavery, nation-building, westward expansion, gender roles, religion, reform, race/ethnicity, immigration, industrialization, class relations. Students use primary sources, historical scholarship.","3","3","No","1","3","OPT - Student Option","-","Periodic Fall, Spring & Summer"
"HIST","1308","Global America: U.S. History Since 1865","Twin Cities","U.S. history since Civil War, in global context. Emancipation. Forms of labor. Immigration. Citizenship. Changing conceptions of race/gender. Hot/cold wars. Reform/rights movements. Globalization. State power. Students use primary sources, historical scholarship.","3","3","No","1","3","OPT - Student Option","-","Periodic Fall, Spring & Summer"
"HIST","1362","Global History of World War II","Twin Cities","This course examines 1) how different countries remember WWII and how memories of the war have been shaped by domestic and international contexts of each country and 2) how WWII changed the world in areas of human rights, the government-society relations, and ethical use of science and technology.  Various faculty members with different geographical and thematic expertise come to the class as guest lecturers throughout the semester.","3","3","No","1","3","OPT - Student Option","-","Every Spring"
"HIST","1364","Introduction to Global Environmental History","Twin Cities","This introductory course focuses on human environment interaction and the role of environmental factors in shaping of world history from the early medieval period, roughly 1000 C.E, to the present day. Beginning with the idea of environmental history and its broad themes, including climate, volcanic eruptions, landscape, plants, crops, animals, insects, disease, pestilence, energy, and technology, the course will enable students not only to understand the complex relationship between human societies and non-human species but also the changing nature and structure of this relationship throughout history. ","3","3","No","1","3","OPT - Student Option","-","Fall Even Year"
"HIST","1365","Global Tourism and the Environment from the late 18th Century to the Present","Twin Cities","This course focuses on tourism and travel. Spanning the period from the late 18th century to the present, it examines the ways in which these phenomena impact how we live, work, interact with our natural environment and other people, and conceive of the world and global forces","3","3","No","1","3","OPT - Student Option","-","Every Fall"
"HIST","1463","An Introduction to Imperialism in Asia, 1850-Present","Twin Cities","Organized around a series of themes, this course will begin with a broad overview of imperialism in Asia before diving into economics of empire, technologies of imperialism, race and gender, nationalism and the end of empire, and neocolonialism. Throughout, the class will center the history of present-day China, India, Southeast Asia, and Japan, emphasizing whenever possible the perspectives of those impacted by empire rather than those perpetuating it. As such, assigned readings focus on primary sources supplemented by relevant secondary research, with optional readings providing significant breadth and depth for interested students seeking to delve further into their own interests or find new avenues of scholarly inquiry. All told, the histories included here represent some of the most significant events in recent centuries, but ones that often go overlooked in an academic context, covered only as a footnote in the histories of the West. Instead, this course will center the history of Asia and the voices of those impacted by imperialism, offering new perspectives on some of the most significant moments that shaped-and continue to shape-our contemporary world. 

Designed as an introductory course for those unfamiliar with the history of Asia, this class approaches a broad geographic and temporal range through case studies, diving deeply into crucial historical moments rather than providing an exhaustive overview of more than two centuries of Western imperialism. Simultaneously, this class will introduce students to the process of historical analysis itself using a substantial focus on primary sources, instructional time spent in libraries and archives, and a well-supported, intensive research essay process as a way to encourage them to think critically about the historical project while also honing their own historiographical skills. Overall, students will leave this course with a strong foundation in the history of Asia and the history of Western imperialism along with real practice “doing” history, preparing them for their future within the Department of History, at the University of Minnesota, and beyond. 
","3","3","No","1","3","OPT - Student Option","-","Periodic Spring"
"HIST","1534","Introduction to Jewish History and Cultures","Twin Cities","This course traces the development of Judaism and Jewish civilizations from their beginnings to the present. With over three millennia as its subject, the course must of necessity be a general survey. Together we will explore the mythic structures, significant documents, historical experiences, narratives, practices, beliefs, and worldviews of the Jewish people. The course begins by examining the roots of Judaism in the Hebrew Bible and the history of ancient Israel but quickly focuses on the creative forces that developed within Judaism as a national narrative confronted the forces of history, especially in the forms of the Persian, Greek, and Roman empires. Rabbinic Judaism becomes the most dominant creative force and will receive our greatest attention, both in its formative years and as it encounters the rise of Christianity and Islam. After studying the Jewish experience in the medieval world, we will turn to Judaism’s encounter with the enlightenment and modernity. The historical survey concludes by attending to the transformations within Judaism and Jewish life of the last 150 years, including a confrontation with the experience of the Holocaust. Woven throughout this historical survey will be repeated engagements with core questions: “Who is a Jew?” “What do Jews believe?” “What do Jews do?” “What do we mean by ‘religion’?”   “How do Jews read texts within their tradition?” And perhaps most importantly, “How many answers are there to a Jewish question?” Students in this course can expect to come away with some knowledge of the Bible in Judaism, rabbinic literature and law, Jewish mysticism and philosophy, Jewish nationalism and Zionism, Jewish culture, ritual, and worship in the synagogue, the home, and the community, and Jewish celebrations of life cycle events and the festivals.","3","3","No","1","3","OPT - Student Option","-","Every Fall"
"HIST","1807","The Constitution: A People's History from the Founding to Now","Twin Cities","This course examines struggles over the U.S. Constitution from the founding to the present. It foregrounds the experience of diverse communities and their efforts to change, preserve, or realize constitutional meaning. Through a history of rights and citizenship, powers of government, and social movements' pursuits of justice, it conveys the centrality of constitutional history to American life.","3","3","No","1","3","OPT - Student Option","-","Every Fall & Spring"
"HIST","1809","The Presidency: Power, Politics, and Policy in the United States","Twin Cities","This course explores the emergence, meaning, and evolution of the American presidency. We will examine the nature of presidential power and ask how and why those powers have changed over time. We will explore the impact of politics and political parties on the American presidency. We will consider how presidents shape policy and analyze the relationship between power, politics, and policy.","3","3","No","1","3","OPT - Student Option","-","Fall Even Year"
"HIST","1811","The Sixties: History & Memory","Twin Cities","The Sixties was an incredibly dynamic decade in the United States and around the world. It was a decade of powerful social movements from the Civil Rights and Black, Brown, Yellow and Red Power movements to the countercultural, student/campus, anti-war, feminist, and environmental movements. It was also marked by the rise of a series of New Right movements from the rise of the Barry Goldwater to the election of Richard Nixon and the transformation of both the Democratic and Republican parties. Major immigration reform, transformations in the nation's educational and health care systems, along side new patterns of consumption and new forms of media were also products of the Sixties. From the Cold War to the Vietnam War, from anti-imperialism and anti-colonialism to third world revolutions, Americans transformed the world and the US was transformed by the world in the sixties.

Fifty years removed from the sixties, the idea of the sixties remains alive in the American imagination. It remains alive and in tension with the new movements, like Black Lives Matters, and in political thought, as, for example, in Donald Trump's repeated invocation of the ""silent majority."" 

Students will explore a wealth of primary sources and be introduced to the dynamic historiography of the 1960s. As a class, we will also consider how the sixties continues to serve as a powerful trope that organizes political and social thought in the 21st century.","3","3","No","1","3","OPT - Student Option","-","Every Fall"
"HIST","3051","Ancient Civilization: Near East and Egypt","Twin Cities","A broad survey of ancient Near Eastern and Egyptian history and culture from the prehistoric to the rise of Persia around 550 B.C.","3","4","No","1","4","OPT - Student Option","-","Periodic Fall"
"HIST","3052","Ancient Civilization: Greece","Twin Cities","A broad survey of ancient Greek culture and history from the third millennium B.C. to the death of Alexander the Great in 323 B.C.","3","3","No","1","3","OPT - Student Option","-","Every Fall, Spring & Summer"
"HIST","3053","Ancient Civilization: Rome","Twin Cities","A broad survey of the culture and history of Rome from its origins to the decline and fall of the Roman Empire in the third and fourth centuries A.D.","3","3","No","1","3","OPT - Student Option","-","Every Spring & Summer"
"HIST","3054","Ancient Egypt and its Neighbors","Twin Cities","Ancient Egypt exerts fascination upon modern societies, as it did upon its ancient contemporaries. The decipherment of the hieroglyphic script, in the early 19th century CE, opened the way to recovering its history all the way back to the invention of the writing system more than 5,000 years ago. Ancient Egypt has meanwhile been a special focus of racialized interpretations of civilization, from the birth of modern Egyptology onward. Europeans of the colonial age saw Egyptian civilization as an anomaly in Africa, measured excavated skulls in an effort to prove its extraneous origins and segregated it from its geographic context. But Egyptian civilization did not develop in isolation. Rather it developed in concert with its neighbors upstream along the Nile, across adjacent deserts and seas, and over the land bridge to southwestern Asia. Its most important neighbor in northeastern Africa was the land of Kush (Nubia), where a series of cultures and states co-evolved with those of Egypt. Archaeological exploration continues to add to our knowledge of these interconnected pasts. This course will examine the history of Egypt, Kush, and adjacent regions from the late 4th millennium BCE, when the first states formed in the Nile Valley, to the late first millennium BCE, when Egypt fell under Roman rule while the kingdom of Meroe ruled the upper Nile. While the civilizations of northeastern Africa are the focus, the course will also examine their interactions with cultures of the Near East and Eastern Mediterranean. Since knowledge of ancient societies is derived from the texts and artifacts they produced, complete with their original context so far as possible, this course will emphasize primary sources, including texts (in translation), images, and archaeological remains.
There are no prerequisites for the course; the only preparation necessary consists in college-level writing skills, and readiness to learn new information. Be advised that the study of ancient history requires learning a great number of foreign names and terms, as well as a lot of dates. One cannot understand relations between events and phenomena, in particular relations of cause and effect, without knowing their chronology, the participants involved, and their locations. Students must therefore learn the geography of the regions under discussion, the dates of events and periods during the three millennia the course covers, the names of populations and individual persons, and terms pertaining to the subjects of study. These kinds of information form the basis for knowledge and meaningful inquiry.","3","3","No","1","3","OPT - Student Option","-","Periodic Fall & Spring"
"HIST","3061","""Bread and Circuses"": Spectacles and Mass Culture in Antiquity","Twin Cities","Development of large-scale public entertainments in ancient Mediterranean world, from athletic contests of Olympia and dramatic festivals of Athens to chariot races and gladiatorial games of Roman Empire. Wider significance of these spectacles in their impact on political, social, and economic life of the societies that supported them.","3","3","No","1","3","OPT - Student Option","-","Fall Odd, Spring Even Year"
"HIST","3066","Prehistoric Pathways to World Civilization","Twin Cities","How did complex urban societies first develop? This course addresses this question in ten regions of the world, including Maya Mesoamerica, Inca South America, Sumerian Near East, Shang Civilization in East Asia and early Greece and Rome.","3","3","No","1","3","OPT - Student Option","-","Every Fall"
"HIST","3092","Jesus in History, Art & Culture","Twin Cities","Does time, place, and culture affect our picture of Jesus? We'll start by constructing our own Jesus story and then go backwards in time to examine modern times (film, music, and modern art), pre-Civil War America (views of Jesus from enslaved people and their enslavers), Renaissance and Medieval Europe and North Africa (art and architecture), and finally end with the ancient world (art and writings about Jesus, including the biblical gospels). No background in religious studies required, and students of any, all, or no religious background are welcome.","3","3","No","1","3","OPT - Student Option","-","Every Spring"
"HIST","3101","Introduction to Medieval History","Twin Cities","Europe from decline of Rome to early Renaissance. Politics, institutions, society, economy, and culture of Middle Ages.","3","3","No","1","3","OPT - Student Option","-","Every Fall, Spring & Summer"
"HIST","3152","British History From the Seventeenth Century","Twin Cities","Civil War, Revolution, and constitutional settlement. Industrialization and growth of democracy. Rise/decline of British Empire.","3","3","No","1","3","OPT - Student Option","-","Every Spring"
"HIST","3244","History of Eastern Europe","Twin Cities","History of Central and Eastern Europe from the late 18th century to modern times, culture and society, nationalism and formation of nation states, the Bolshevik Revolution, the fall of Austria-Hungary, the interwar period, fascism, World War II, Jews and antisemitism, state socialism after 1945, everyday life under socialism, the Cold War, and the post-socialist transition.","3","3","No","1","3","OPT - Student Option","-","Periodic Fall & Spring"
"HIST","3287","Seeing History through Comics: New Perspectives on the Contentious Past","Twin Cities","Comic-form histories offer new perspectives on the past. Focusing on cases of contentious history, this course will examine how varying perspectives (shaped by class, gender, race, or geo-political position) appear in comic histories. We will compare comic accounts with more traditional forms of historical analysis of select contentious events of modern U.S., European, African and East Asian history.","3","3","No","1","3","OPT - Student Option","-","Periodic Spring"
"HIST","3349","U.S. Women's Legal History","Twin Cities","Women's legal status, from colonial era through 20th century. Women's citizenship, civil rights. Marriage, divorce, and child custody. Reproductive/physical autonomy/integrity. Economic/educational equality.

prereq: Soph or jr or sr","3","3","No","1","3","AFV - A-F or Audit","000959","Fall Odd Year"
"HIST","3362","Global History of World War II","Twin Cities","This course examines 1) how different countries remember World War II and how memories of the war have been shaped by domestic and international contexts of each country, and 2) how WWII changed the world in areas of human rights, the government-society relations, and ethical use of science and technology. Various faculty members with different geographical and thematic expertise come to the class as guest lecturers throughout the semester.","3","3","No","1","3","OPT - Student Option","-","Every Spring"
"HIST","3412","Soccer: Around the World with the Beautiful Game","Twin Cities","How did a kicking game played in a few English schools in the mid-nineteenth century go on to become the most popular organized pastime the world has ever known? In this class, we chart soccer's unlikely rise to global prominence and explore what it can tell us about people, games, and ethics all around the world today.","3","3","No","1","3","OPT - Student Option","-","Spring Odd Year"
"HIST","3413","War in History: Preparing and Making War in World History","Twin Cities","War has been a standard tool for organizing societies, settling disputes, and securing resources. The means and meaning of war have changed in important ways over time and we see very different historical outcomes across different societies. This course exams differences in war making across many societies in Europe, Asia, the Americas, and Africa from 10,000 BC to now.","3","3","No","1","3","OPT - Student Option","-","Every Fall"
"HIST","3415","Migrations in Modern Global History","Twin Cities","This is a liberal education course that emphasizes particular learning outcomes while developing students’ historical and global perspectives. The purpose of HIST 3415 is dispel the impression, common among students, that North America is in some sense unique in its long history of international migrations. The course examines a history of human mobility that stretches from the earliest days of human life on earth down to the present and that begins in Africa before extending to case studies of migrants living and adapting to new social, cultural, and physical environments in every part of the world. Along the way, it introduces students to the intersection of history, humanities and social sciences as ways of knowing about the past and analyzing the present and encourages students to encounter, evaluate, and interpret the past through the use of primary sources.  ","3","3","No","1","3","OPT - Student Option","-","Periodic Fall & Spring"
