"PHIL","3009","Existentialism","Twin Cities","What do we mean when we call something ""existential?""  What do we mean when we speak of an ""existential"" crisis? We seem to mean that our core beliefs and assumptions are affected and the relationship with our environment is ruptured; we have fallen out of normalcy. The term existentialism -- turning existential into a noun -- came into being in the 1940s in France, reflecting the collective experience of societal breakdown, of Nazism, and WW2. It has since been applied to all modes of philosophical inquiry that take an individual's experience of alienation from society as their point of departure. The advantage of making alienation the focus of this class, too, is that it allows us to recognize the precise historical and sociological index of the emergence of an existentialist mode of thought and practice. Existentialism looks very different when it responds to a 19th century crisis of faith (Søren Kierkegaard), to 1950s colonialism (Frantz Fanon), to Weimar Germany's new democracy and the specter of a mass society (Martin Heidegger), or to the neo-authoritarian French society of the 1960s (Simone de Beauvoir). Existentialism then is understood in this class not as a conversation between great thinkers or ideas across time and space, but as a response to a specific crisis of norms and values. It only exists in plural. If existentialist concepts -- like being-in-the world, being-towards-death, or the gaze of the other -- are carried forward, then not without being repurposed. Such situatedness is inherent to existentialism itself. Accordingly, existentialist writers have no creed or ethical stance in common; they are found both on the far (fascist) right and on the Marxist left. They do share though a keen interest in a new language and in literary forms of expression and subsequently, they insist on the individuals' capacity of ""world-making"" -- in rupture and rebellion -- against seemingly compromised societal norms.","3","3","No","1","3","OPT - Student Option","-","Spring Even Year"
"POL","1201","Political Ideas","Twin Cities","This course serves as an introduction to the study of political theory. Political theory analyzes the meaning and significance of fundamental concepts in politics. Starting from such basic concerns as the nature of politics, humans, power, and justice, political theorists explore how these basic starting assumptions organize the norms, practices, and institutions of political and social order. To explore these topics, the field turns to key texts, as well as to political and social events and other media (film, historical documents, etc.). In this introductory course, students will investigate some of the basic texts in political theory, with the goal of learning how to read texts more analytically and to address fundamental questions in political theory. Among the topics that might be the nature of justice and injustice, political obligation and civil disobedience, democracy and other forms of governance. Students who complete this course will understand the deep issues about the nature of politics and will have learned to read and analyze complex texts. They will also have had the opportunity to reflect upon their own ethical engagement in political life and upon the ways in which historically, political ideas change.","3","3","No","1","3","OPT - Student Option","-","Every Fall, Spring & Summer"
"POL","3065","Political Engagement Careers: Planning and Preparing For Your Future","Twin Cities","Are you interested in pursuing a career in public service? Do you plan to run for office in the future, or work in a government agency (such as the State Department or the FBI or the MN DNR), or become a professional campaign manager or lobbyist, or work as an issue activist on a cause important to you? Would you like to learn more about the variety of public service careers open to a college graduate? Do you wonder what motivates people to pursue careers in politics, public administration, and community service, and how these motivations vary across career fields? Would you like to explore some options for future internship or service learning while at the University? Then this course is for you!

This course is the Political Science Department's introduction to careers in political and civic engagement. Through readings focused on theories about and case studies of political engagement, and on the ethics of politics and public service, numerous guest speakers with extensive experience as public service professionals, and a discussion-oriented class format, we will explore the meaning of public service and the main types of public service careers that you could pursue. We will think about the virtues and challenges associated with doing public service work, and how these differ across different types of jobs and venues for serving the public. Finally, you will acquire practical knowledge and skills related to the search for public service work opportunities, including how to write a resume and cover letter, how to conduct an informational interview, networking, and the job search and application process. Intended primarily for first- and second-year undergraduates, but open to students of any major at any point in their undergraduate program.","3","3","No","1","3","OPT - Student Option","-","Every Spring"
"POL","3225","American Political Thought","Twin Cities","This course provides an introduction to several key periods and some of the leading concepts and debates in American political thought. It might also focus on a broader theme such as: conceptions of destiny, mission, and exceptionalism; arguments over economic development and inequality; or debates over government and corporate power. The course will begin with Puritan religious and political thought, tracing its secularization over time. Considerable attention will be paid to the ideas behind the Declaration of Independence and the Constitution, such as the social contract and the right of resistance to civil authority, civic republicanism, and the founders’ new science of politics and government. The course will consider some if not all of the following: debates over slavery and emancipation, women’s rights, the rise of imperialism and nationalism, race and racism, and the rise of rule by public and private bureaucratic organizations, and the consequences of these developments for the possibility of continued individual liberty, equality, and justice. This course requires considerable reading of difficult texts. The ultimate goal of this course is for students to gain a deeper understanding of American political thought as a product of the country’s ever-evolving political discourse. prereq: Suggested prerequisite POL 1201","3","3","No","1","3","OPT - Student Option","-","Every Fall, Spring & Summer"
"POL","3265","Ideas and Protest in French Postwar Thought","Twin Cities","France witnessed a number of extraordinary events in the 20th century:  the carnage and trauma of World Wars I and II; the Vichy regimes collaboration with German Nazis; the general strike and student protests of the 1960s; the tensions prompted by anti-colonialism and later decolonization in North Africa; and the challenges of post-colonialism and racial politics. This course will examine these events, the political and ethical challenges they raised, and the intellectuals who shaped the ensuing public debates. It will draw on historical documents, cultural media (e.g. posters, art, film), and philosophical texts to explore contemporary France in its century of politics and protest.  Thinkers range from film-maker Gillo Pontecorvo, to philosopher-playwright Jean-Paul Sartre, to philosopher Michel Foucault.","3","3","No","1","3","OPT - Student Option","-","Every Fall & Spring"
"POL","3272","Colonial Encounters","Twin Cities","If politics classically is the exercise of power by rulers over the ruled, how have different communities, traditions, and contexts sought to organize this power and render it just?  What are the lessons to be learned from looking to past experiences with political communities ranging in size from the face-to-face polis to the far-flung reaches of empire? How does the ‘discovery’ of other societies disorient our usual frames of reference for thinking about political community? What different frames might we use? What should we make of problems that seem to exceed the capacity of existing institutions to manage, such as mass violence and total war? 

The aim of this course is to examine exemplary moments that consider the radical conflict of interpretations that can arise when different cultures come into contact with one another (whether through trade, war, intellectual exchange, or the like), and how these exchanges transform the scale of political community (local, regional, global, universal). Here, we are concerned with large-scale upheaval, processes that are more than simply difficult political problems, but in fact transform the very institutions, relationships, and concepts through which we come to understand what political community is and can be. The substantive focus of the course varies according to instructor, and may include: Colonial Encounters; the Black Atlantic; Revolutionary Moments; Colonialism and the Post-colony.
","3","3","No","1","3","OPT - Student Option","-","Periodic Fall & Spring"
"POL","3767","Political Psychology of Elite Behavior","Twin Cities","Why do some world leaders seek cooperation while others advocate war? Why do some Presidents effect major change while others are relegated to the dustbin of history? How does the personality of leaders affect how they behave in office? In this class, we will address questions like these by exploring the psychology of political elites, those members of society who wield outsized influence over political decisions. This outsized influence means that understanding how elites think is particularly important. It is also unusually difficult, leading some to argue that political psychology can play little role in understanding elite decision-making.

 

Students will exit the class having mastered a body of knowledge about elite decision-making and learned about the different approaches that scholars take to study these decisions. They will also gain the critical capacity to judge arguments about politics, the ability to identify, define, and solve problems, and the skill to locate and critically evaluate information relevant to these tasks. Finally, this course takes a cooperative approach to learning, and many course activities will be structured around learning and working with a group of fellow students over the course of the semester. This course fulfills the Civic Life and Ethics theme requirement.","3","3","No","1","3","OPT - Student Option","-","Fall Odd, Spring Even Year"
"POL","4267","Imperialism and Modern Political Thought","Twin Cities","How has political theory been shaped by imperialism? We will investigate this question through a study of such key thinkers as Kant, Mill, Marx, Lenin, Césaire, Fanon, and Gandhi, reading them through the lens of empire. Our goal is to analyze how such thinkers reflected upon, problematized and, at times, justified forms of Western imperialism. We will look at their explicit reflections on empire, as well as more tangential or ostensibly separate themes that may have only been shaped by the imperial context in indirect ways. Finally, we will reflect upon our contemporary location as readers and agents situated in the wake of these political and intellectual developments, analyzed through the question of what it means to engage in anti-colonial, decolonial, and/or postcolonial critique. This course will combine lectures by the professor with student-led seminar discussion.","3","3","No","1","3","OPT - Student Option","-","Periodic Fall & Spring"
"RELS","3671","Hinduism and the Making of Modern India","Twin Cities","This course explores the role that Hinduism has played in Indian culture and politics the late 18 th c. to the present, and the way that Hinduism itself has been transformed during this period. In this course, we shall be guided by five overarching questions.
•	What are the key texts and everyday ritual practices of Hinduism, and how have these changed over the course of the last two centuries?  
•	What is the changing place of caste and especially the practice of untouchability in the understanding of what means to be a Hindu?  
•	What role do concerns about the role of women play in the religious reform movements and the emergence of new Hindu identities? 
•	What is the political role played by visions of Hinduism at and in different historical developments?  
By weaving together an analytical narrative centered around these four questions, we shall trace the remaking of Hinduism as a modern religion—one that wrestles with questions around nationalism, the public-private divide, the meaning of worship in a secular society, the relation with other religions, and equality of  co-religionists.   ","3","3","No","1","3","OPT - Student Option","-","Periodic Fall & Spring"
"RELS","4309","Religion in American Public Life: Culture, Politics, and Communities","Twin Cities","How diversity/vitality of American religion shape public life. How religious groups engage in political action, foster understandings of democracy/styles of civic participation. Volunteering/service activities. Race, poverty, the family, sexuality.prereq: Soc majors/minors must register A-F","3","3","No","1","3","AFV - A-F or Audit","-","Periodic Fall & Spring"
"RM","1201","Fashion, Ethics, and Consumption","Twin Cities","Apparel business. Overview of steps in the process of creating, merchandising, selling, and consuming apparel. Various ethical positions reflected in manufacturer, retailer, and consumer decision making are considered.","3","3","No","1","3","OPT - Student Option","-","Every Fall & Spring"
"SCMC","3221","On Television","Twin Cities","We will study writings on television and specific TV shows from a variety of angles to understand the rise of American broadcast technologies, how race and class are crafted on TV, representations of gender and the home, postmodernity and late capitalism, the rise and demise and of taste, global television and the public sphere, the production of 'reality' in our present historical moment, and changes in televisual technologies. Throughout the course, we will also consider what constitutes television—the technology, the form, and the content—and learn to read these three facets of it concurrently.","3","3","No","1","3","OPT - Student Option","-","Every Fall & Spring"
"SOC","3101","Sociological Perspectives on the Criminal Justice System","Twin Cities","This course introduces students to a sociological account of the U.S. criminal justice system. We will critically examine the components, dynamics, and effects of policing, criminal courts, community supervision, jails, and prisons. Throughout the course, we focus on sociological understandings of these processes, with particular attention to ethnic, racial, class, and gender inequalities as well as long-term problems associated with the high rate of criminal justice supervision in the U.S.

prereq: [SOC 1001] recommended, Sociology majors/minors must register A-F","3","3","No","1","3","AFV - A-F or Audit","-","Every Fall, Spring & Summer"
"SOC","3101H","Honors: Sociological Perspectives on the Criminal Justice System","Twin Cities","This course introduces students to a sociological account of the U.S. criminal justice system. We will critically examine the components, dynamics, and effects of policing, criminal courts, community supervision, jails, and prisons. Throughout the course, we focus on sociological understandings of these processes, with particular attention to ethnic, racial, class, and gender inequalities as well as long-term problems associated with the high rate of criminal justice supervision in the U.S.

Additional special assignments will be discussed with honors participants who seek to earn honors credit toward the end of our first class session. Examples of additional requirements may include:
·   Honor students will be expected to interview a current Sociology graduate student working on a LCD topic. Following this, each student will individually be expected to do an in-class power-point presentation explaining how the interviewees? research relates with themes presented in the course. Students will also be expected to meet as a group and individually with the professor four times during the course semester. 
·   Sign up and prepare 3-4 discussion questions in advance of at least one class session.
·   Work with professor and TA on other small leadership tasks (class discussion, paper exchange, tour).
·   Write two brief (1-page) reflection papers on current news, or a two-page critique of a class reading
·   Attend a presentation, workshop, or seminar on a related topic for this class and write a 2 page maximum reflective paper.

prereq: [SOC 1001] recommended, Sociology majors/minors must register A-F, honors","3","3","No","1","3","A-F - A-F Grade Basis","000571","Every Fall, Spring & Summer"
"SOC","4309","Religion in American Public Life: Culture, Politics, & Communities","Twin Cities","How diversity/vitality of American religion shape public life. How religious groups engage in political action, foster understandings of democracy/styles of civic participation. Volunteering/service activities. Race, poverty, the family, sexuality.

prereq: Soc majors/minors must register A-F","3","3","No","1","3","AFV - A-F or Audit","-","Periodic Fall & Spring"
"SOC","4309H","Honors: Religion in American Public Life - Culture, Politics, & Communities","Twin Cities","How diversity/vitality of American religion shape public life. How religious groups engage in political action, foster understandings of democracy/styles of civic participation. Volunteering/service activities. Race, poverty, family, sexuality.

Additional special assignments will be discussed with honors participants who seek to earn honors credit toward the end of our first class session.  Students will also be expected to meet as a group and individually with the professor four times during the course semester.
 
Examples of additional requirements may include:
·   Sign up and prepare 3-4 discussion questions in advance of at least one class session.
·   Work with professor and TA on other small leadership tasks (class discussion, paper exchange, tour).
·   Write two brief (1-page) reflection papers on current news, or a two-page critique of a class reading
·   Attend a presentation, workshop, or seminar on a related topic for this class and write a 2 page maximum reflective paper.
·   Interview a current Sociology graduate student and present briefly in class or write a reflective piece, not more than 2 pages in length, to be submitted to the Professor.","3","3","No","1","3","A-F - A-F Grade Basis","000571","Periodic Fall & Spring"
"SPAN","3401","Latino Immigration and Community Engagement","Twin Cities","In 3401, students work with Latino immigrants in the community. They analyze U.S. power structures and human rights related to emigration, issues on the U.S./Mexican border, laws, and treatment of immigrants in the U.S. They study the economic and cultural contributions of Latines in MN, as well as social changes created by them. There is much interaction with Latine immigrants and activists in the classroom and the community.

prereq: C- or better in SPAN 3015W or SPAN 3015V or SPAN 3019W","3","3","No","1","3","OPT - Student Option","011071","Every Fall & Spring"
"SPAN","3403","Latino Immigration on US/Mexican Border","Twin Cities","This course takes place off campus, through an organization called ""Border Links"" that is located in Tucson and works with migrants. Students will experience firsthand many issues that directly affect the migrant journey and meet with many immigrants to hear their personal stories. In addition to learning the history of the situation on the border, students will take a tour of the border wall, visit neighboring communities that work with immigrants, do a legal immigration simulation, walk the migrant trails in the Sonoran Desert and leave water there with Humane Borders, go to a Operation Streamline Deportation Court hearing, visit migrants seeking political asylum in Florence Detention Center, talk with a leader in Southside Workers Center, meet with an author focusing on Border Patrol, and more.

Themes explored in this course include the connection between the roots of emigration and the global economy of violence in Central America; human rights on the border; and issues immigrants face in the US such as immigrants living in the US with or without legal documents, detention and deportation and the work they are doing to make a more just immigration system. Students will gather information during their stay and create a presentation to be shown to people in Minnesota upon returning from the border.","3","3","No","1","3","OPT - Student Option","010169","Periodic Summer"
"TH","1102","Stage, Screen, Society: Performance in the Media Age","Twin Cities","From viral memes to ‘fake news,’ from video-gaming to vlogging, our rapidly changing media-scape is at the center of public debates about everything from mental health to the future of democracy. This course engages with these debates to understand the power of new media to shape our identities and values, our cultural habits and communities, our economy and political life. We discuss how we “perform ourselves” through media, giving rise to social anxieties about truth, authenticity, equality, and belonging, but also to tremendous opportunities for self-expression and connection. And we investigate how our performances are monetized or instrumentalized by governments, social movements, or corporations. How did our current media system develop, and whose interests has it served? How, for better or worse, has the social media age changed us and the world we live in? And how can we make sure that in the future that change is for the better?","3","3","No","1","3","OPT - Student Option","-","Every Fall"
"YOST","1001","Seeing Youth, Thinking Youth: Media, Popular Media, and Scholarship","Twin Cities","This course is an invitation to meet and engage with the field of Youth Studies. This is an introductory course to a subject you already know about – you’ve lived its content; thought about it; you may even written poems, made a video or posted a meme about this life-moment. Since you know this so well, why take a university course on it? You will leave this course better able to notice the young people around you; wonder about them and their lives; name, describe and analyze what you see and hear and read about youth. This course is about all young people. This means that we are attentive to including material about youth from diverse backgrounds, many ethnic/racial, social class, linguistic, and geographic locations or those who have a variety of physical and mental capacities, those who are “normal” and “typical” and those who are “not”. Together, we will examine myths and stereotypes about youth, where they come from, and how to deconstruct them using a variety of lenses-- social, popular and news media, young adult novels, academic articles, biographies, and more. We will do this through engaging class discussions and activities. You will learn how to use critical ethnography “in the field” where you will observe and write about youth in a variety of settings including malls, sporting events, busses, coffee shops, and music venues. We believe that an introductory college course is a space and time to reflect, analyze, and learn about what matters to you, about who you are and about the work others have done and what you want to do. In these ways, this course introduces ways of being an engaged and thoughtful student, citizen and professional, all of which require critical thinking skills and an ability to work across difference and diversity. In this course, students will develop skills in assessment, reflection/reflexivity, deconstruction, empathy and judgement; all precursors for professional decision-making in careers like youth work, policy, public health, education, communications, and other fields. We hope this course may lead to reflecting on your occupational future and vocational call.","3","3","No","1","3","OPT - Student Option","-","Every Fall & Spring"